subreddit,title
explainlikeimfive,ELI5: Why do some animal mothers seem unintrested in their babies after giving birth?
explainlikeimfive,Eli5 what is tax-loss harvesting and why should I bother doing it?
explainlikeimfive,Eli5 what are phages (the medical alternative to antibiotics) and how do they work?
explainlikeimfive,Eli5: Why is shelter important when facing harsh conditions like a thunderstorm?
explainlikeimfive,ELI5: Why to bananas turn brown once placed into the freezer ? Yet if you buy a bag of frozen bananas (for a smoothie etc) they are still yellow?
explainlikeimfive,eli5 why some medications increase the chance of suicidal thoughts?
explainlikeimfive,Eli5 how computer could help more than human brain or solving different problems if everything inside it has been installed by humans
explainlikeimfive,ELI5/ Why can some foods be fermented for long times and others can’t.
explainlikeimfive,ELI5: Can inertia be used as a force for propulsion?
explainlikeimfive,ELI5 how carpenters join wood together into a + sign for wall foundations
explainlikeimfive,Eli5: why are some reflections (like in doorknobs) upsidedown?
explainlikeimfive,ELI5: How does colleagen synthesis work?
explainlikeimfive,ELI5 Why are stocks worth anything on the secondary market?
explainlikeimfive,ELI5: What is shift assist in manual transmission and how does it work?
explainlikeimfive,Eli5: how can the world be in debt?
explainlikeimfive,Eli5 What is causing the high rate of inflation in Australia?
explainlikeimfive,(ELI5)How do your eyes stay aligned and looking in the same direction?
explainlikeimfive,eli5 How do you determine the sex of baby ducks?
explainlikeimfive,ELI5: Help me understand the use and measure of 'century/centuries'.
explainlikeimfive,ELI5 Land Surveys
explainlikeimfive,ELI5 How hashing works ?
explainlikeimfive,"ELI5: How do placebos and nocebos work, and how strong is the relationship between medicinal treatment and optimism or pessimism of the treatment?"
explainlikeimfive,ELI5: How it's possible Mississippi and other states that Americans perceive as very poor have a higher GDP per capita than countries we perceive as rich like France
explainlikeimfive,ELI5 Criminal Gangs
explainlikeimfive,ELI5 why is there an electrical wine off certain devices but not others? And can it be fixed?
explainlikeimfive,"ELI5: If yeast is alive, how can it survive without any food and live for so long?"
explainlikeimfive,"ELI5: Why are Latin and Greek words still heavily used everywhere? Like university frats and sororities, latin honors, and Biological terms? Why would they not use the English equivalent words instead for these words specifically?"
explainlikeimfive,ELI5: Why do we see a puddle of water on a hot day on a road when there really isn't a puddle?
explainlikeimfive,ELI5 Why do we need non-euclidean geometry? Don't Euclidean shapes like sphere and hyperbola suffice?
explainlikeimfive,ELI5: why can’t we eliminate side effects from certain drugs?
explainlikeimfive,ELI5: How is gentrification combatted?
explainlikeimfive,ELI5:How does gravity increase as we go deeper in earth?
explainlikeimfive,"ELI5: What is it about the color yellow exactly that makes it subjectively less visible against a white background than say, blue or red?"
explainlikeimfive,ELI5: Why does everything look blue once we open our eyes after keeping them closed under sunlight?
explainlikeimfive,Eli5 what happens if a cemetery runs out of space to bury bodies?
explainlikeimfive,eli5: why does having more muscle mass increases bmr (Basal metabolic rate)
explainlikeimfive,ELI5: What is economic growth and how does it create more money?
explainlikeimfive,[eli5] glow in the dark
explainlikeimfive,"ELI5 business valuations - cash free, debt free; net asset basis; working capital adjustment"
explainlikeimfive,ELI5 - central heating
explainlikeimfive,ELI5 how racing pigeons train themselves?
explainlikeimfive,ELI5: How were old/ancient texts translated?
explainlikeimfive,ELI5: Why do capybaras tend to live longer in captivity compared to in the wild?
explainlikeimfive,ELI5 How did Romans do (advanced) math using Roman numerals?
explainlikeimfive,ELI5: how do the pop it's work?
explainlikeimfive,ELI5: why people and animals express pain by screaming?
explainlikeimfive,ELI5 why do honeycombs turn from circle to hexagons?
explainlikeimfive,ELI5: Why does a blown fuse show a voltage when measuring it with a multimeter?
explainlikeimfive,"Eli5: Historically, time during the night was measured by 'watches'; eg. First watch, Second watch, etc. How did people determine when one watch ended and the next began?"
explainlikeimfive,ELI5: Can a paradox exist if there are infinite outcomes?
explainlikeimfive,ELI5 the poison pill in publicly traded companies; how does it work?
explainlikeimfive,eli5 what alcohol does to livers?
explainlikeimfive,"ELI5: Why does fermenting sugar create alcohol, but fermenting cabbage doesn't?"
explainlikeimfive,ELI5 how does the “tab” system work at bars?
explainlikeimfive,ELI5 What role does your mucous have when you're sick.
explainlikeimfive,ELI5: How does a manta ray and stingray produce electricity that's harmful enough to stun prey?e
explainlikeimfive,"ELI5: What causes voice loss, after shouting for a long period of time or sickness?"
explainlikeimfive,eli5 the difference between postgrad degree and master's degree
explainlikeimfive,ELI5 tires and air pressure
explainlikeimfive,ELI5: How can Prince Rupert's Drop be so strong? Isn't it just ordinary glass?
explainlikeimfive,ELi5: What is the feeling of relief you get when you take a breath of fresh outside air after being stuck in stale air like a hospital or airplane for prolonged periods?
explainlikeimfive,eli5 what is the psychological reason for instinctively matching our walking pace with the beat of nearby music?
explainlikeimfive,ELI5: What the hell does the monarch in the UK and the rest of the royal family do as opposed to the prime minister?
explainlikeimfive,Eli5 what is a phasor?
explainlikeimfive,ELI5: How do needleless injections work?
explainlikeimfive,ELI5: What are the unusual magnetic behaviors/behaviors of europium?
explainlikeimfive,"Eli5 different between Hz and FPS, how does it help improves gaming experience."
explainlikeimfive,"Eli5- What does Réne Descartes means when he says ""i think therefore i am""?"
explainlikeimfive,ELI5: Why does high blood pressure in arteries help plaque build up?
explainlikeimfive,ELI5: How do nostril wounds heal?
explainlikeimfive,ELI5: why can putting hot liquid in a blender cause it to explode?
explainlikeimfive,"ELI5: Dermatologists, why does some pimples hurt more than others?"
explainlikeimfive,eli5: How do nuclear plants _actually_ generate steam?
explainlikeimfive,ELi5: What happens to excess calories that aren't used or stored?
explainlikeimfive,Eli5 systems thinking &amp; design thinking
explainlikeimfive,ELI5: What prevents anti air rounds from damaging the surface below the target?
explainlikeimfive,ELI5: Why is the weather statistically cloudier and more rainy mid-week than any other time?
explainlikeimfive,ELI5: How does viewmodel work in android development
explainlikeimfive,ELI5: Is natural fabric still cooler than polyester if it's heavier?
explainlikeimfive,ELI5: If you were to deconstruct a fully charged battery cell by cell what happens to the energy stored?
explainlikeimfive,Eli5: why are whole and natural numbers two different categories? Why did mathematicians need to create two different categories of numbers just to include and exclude zero?
explainlikeimfive,"ELI5: Why was bicycle invented after the steam engine, given it is a much simpler mechanism?"
explainlikeimfive,ELI5 - how are people who are prone to motion sickness different from those who aren’t?
explainlikeimfive,eli5 - Allergies and Immunotherapy
explainlikeimfive,ELI5: How do mobile phones connect to the internet without wifi?
explainlikeimfive,ELI5: What is happening on a physiological level when individuals who experience dissociation become conscious that they are dissociating?
explainlikeimfive,"ELI5, why do winches and other such systems have chains instead of simply fitting the gears into each other?"
explainlikeimfive,Eli5: What prevents us from mass-producing glass panels as hard as Prince Rupert’s drop?
explainlikeimfive,ELI5: Why do we and other animals huff when frustrated?
explainlikeimfive,ELI5: would base 12 make maths easier than base 10?
explainlikeimfive,"Eli5: What's the difference between NSVT, idioventricular rhythm or accelerated idioventricular rhythm (AIVR) apart from the difference in the heart rate?"
explainlikeimfive,Eli5 how does ad revenue on YouTube work
explainlikeimfive,ELI5: Why does holding weights underwater not make you float?
explainlikeimfive,ELI5: How does crystal deodorant sticks work?
explainlikeimfive,Eli5: what would be needed for an organism to breathe and use nitrogen
explainlikeimfive,ELI5: How did global carbon dioxide emissions decline only by 6.4% in 2020 despite major global lockdowns and travel restrictions? What would have to happen for them to drop by say 50%?
explainlikeimfive,"Eli5 - How do painters paint so extremely precise details, to the point that the art looks like a camera picture?"
explainlikeimfive,Eli5: What's the difference between men and plants in the sun?
explainlikeimfive,ELI5: How did HIV spread from non-human primates to humans?
explainlikeimfive,"ELI5: Why does the colour wheel work, when light is actually a linear progression (i.e. from infrared etc to visible light to ultraviolet and beyond)? How does violet loop round to red in the wheel and it still functions well?"
explainlikeimfive,eli5 how CG movie lighting worked before Path Tracing was used?
explainlikeimfive,ELI5: How are strictly carnivores/herbivores not nutritionally deficient?
explainlikeimfive,ELI5: What is happening to our necks when we “sleep on it wrong”?
explainlikeimfive,eli5 What makes a material a good conductor of electricity?
explainlikeimfive,Eli5 why a modified car is recommended to run e85 but factory super cars run pump gas
explainlikeimfive,ELI5 Stomach acid in space?
explainlikeimfive,"Eli5 When a brokerage lends out a stock share , how do two or more people then own a share of a company , and then do multiple people receive dividends from the company ?"
explainlikeimfive,ELI5: How do trees absorb the noise surrounding them?
explainlikeimfive,ELI5-How do chemicals that enter our body know where to go?
explainlikeimfive,"ELI5: why did old (like 90s/2000s) GPS take up to 15 minutes to get a lock, in giant bulky units, but my running watch gets it in 15 seconds?"
explainlikeimfive,"ELI5: if washing machines, dishwashers etc are designed to clean things, why does mould build up in them?"
explainlikeimfive,ELI5: How does a magnetic drawing boards work? And how come the Megasketcher looks so crisp compared to other?
explainlikeimfive,"ELI5: Why and how do modern navies use tall-ships as training ships? For example, the spanish Juan Sebastian de Elcano."
explainlikeimfive,"Eli5-Why do electrons,despite being negatively charged,don't collapse into the positively charged nucleus?"
explainlikeimfive,Eli5: How can price caps lead to a rise in inflation?
explainlikeimfive,ELI5: What is the Calabi conjecture and why does it matter?
explainlikeimfive,Eli5 - How do CDs work? What gets read by the computer/ what does buring a CD mean?
explainlikeimfive,"ELI5: Usb Connector, pins transferring data"
explainlikeimfive,ELI5: how does the dominant eye sometimes move faster?
explainlikeimfive,ELI5 Fraction of Inspired Oxygen (FIO2)
explainlikeimfive,ELI5 How does the hippocampus generate new memories ? Is it true some studies suggest that the brain needs to move those neuron circuitry to the cortex only that can make true long term memory ?
explainlikeimfive,"ElI5, why do we humans feel anger towards those who caught us doing wrong instead of shame?"
explainlikeimfive,ELI5 what is money laundering?
explainlikeimfive,"ELI5:Why do some objects float in water while others sink, even if they are the same size?"
explainlikeimfive,ELI5: Why do they top up turbine engine oil frequently?
explainlikeimfive,eli5 how we're not running out of music
explainlikeimfive,Eli5 what DEF (diesel exhaust fluid) is and what it does.
explainlikeimfive,"eli5: Why (or where) did the notion that people’s eyes have the ‘light die out’ in them, or get dull when they die?"
explainlikeimfive,ELI5: How do unethical hackers hack people and access their webcam and location?
explainlikeimfive,"ELI5 why is a drinking heart rate of 130 bad, but a jogging heart rate of 130 good?"
explainlikeimfive,Eli5 what was the purpose of “number stations” like the ones recorded in the Cornet project?
explainlikeimfive,"eli5 why are bike saddles so skinny, why not just have a regular sized seat"
explainlikeimfive,"ELI5 - When laying on one side, why does the opposite nostril clear and seem to shift the ""stuffiness"" to the side you're laying on?"
explainlikeimfive,ELI5 How are EM waves able to travel through space and mechanical waves are not?
explainlikeimfive,ELI5: Why do in store demos for TVs always look better than whatever programming you end up watching when you bring the TV home?
explainlikeimfive,eli5: why are pickled turnips pink?
explainlikeimfive,"ELI5: why is it that some plants will resprout/continue to grow if pieces of them are left behind after being dig up while others will die? What factors determine if a plant will remain viable or not? Relatedly, why can some plants be divided and continue to survive while others cannot?"
explainlikeimfive,Eli5 how operators continuously balance the electrical grid in real time?
explainlikeimfive,"ELI5: why do websites, where you buy stuff, still need that ""don't use the browser back button to click away when you are making a purchase"". Have we not got a better solution?"
explainlikeimfive,ELI5: how does alcohol affect sleep?
explainlikeimfive,"ELI5 How isn't Taylor Swift's ""Taylor's Version"" copyright?"
explainlikeimfive,"Eli5 How do they build structures in sea? Oil platforms, pipes in deep sea etc..."
explainlikeimfive,"ELI5: Why does sourness make us cringe or just ""ugh!"""
explainlikeimfive,"eli5: In case of a public outtage, how can the city's electricians track down which part of the city cable is faulty/ripped off so that they can fix it?"
explainlikeimfive,ELI5: Why do computers and programs freeze and have to be force closed/restarted?
explainlikeimfive,"ELI5: Why is a grandparent's sibling a ""great-aunt/uncle""?"
explainlikeimfive,ELI5: Why can you put food too hot to hold with bare hands in your mouth with no issue?
explainlikeimfive,ELI5: how comes that there's seemingly no site which would automatically detect your system stuff to say if you meet requirements to a game?
explainlikeimfive,ELI5 Why does audio and video take so much storage?
explainlikeimfive,eli5: How does putting a thin cloth over the nose prevent the smelly smells?
explainlikeimfive,ELI5: Why do we have a dominant hand?
explainlikeimfive,"ELI5 - What makes some fruit “freezable” and others not? Here (in America, anyway) you can buy frozen mango and peaches and berries, but not oranges or apples or pears."
explainlikeimfive,Eli5 : what is the difference between buttermilk and yogurt?
explainlikeimfive,"ELI5: The Higgs is a field scalar field, meaning it has a numerical value at every point in space. What does this value mean?"
explainlikeimfive,"ELI5 If Australia is one tectonic plate, why does Melbourne get earthquakes?"
explainlikeimfive,"Eli5 Why do many motorbikes backfire on deceleration, e.g. down steep hills"
explainlikeimfive,eli5: How do they predict the weather
explainlikeimfive,ELI5: Why are gunshot exit wounds usually larger than entry wounds?
explainlikeimfive,Eli5 conjunction junction
explainlikeimfive,Eli5: how blue eyes are different
explainlikeimfive,ELI5: Why can't you hear the drone in drone footage?
explainlikeimfive,ELI5: How does whiplash (the neck injury) occur?
explainlikeimfive,"ELI5: Back in the day, what did people do with their horse after they rode them to work or school?"
explainlikeimfive,ELI5: How do they synchronize the motor sound during motor races with the live image?
explainlikeimfive,ELI5: What exactly is Black Propaganda? And what are examples of this form of propaganda?
explainlikeimfive,ELI5: When (and how) is physical contact allowed in women’s NCAA lacrosse?
explainlikeimfive,ELI5: How do computers resize images?
explainlikeimfive,"ELI5 Physics - electric field and information spheres. If I understand this correctly, a moving electron which suddenly stops, can make an electric field from a point that it never reached?"
explainlikeimfive,ELI5 why do our our arm and hands shake when exerting max effort?
explainlikeimfive,eli5: potential energy and distance
explainlikeimfive,Eli5 how does decompression illness kill you?
explainlikeimfive,ELI5 How do vocal chords create sounds?
explainlikeimfive,ELI5:How does applying pressure to a bleeding wound stop the bleeding?
explainlikeimfive,eli5 How does bluetooth work?
explainlikeimfive,"ELI5: How do earthworms burrow so fast, do they dig with their mouths or something else?"
explainlikeimfive,ELI5: What does your body need to do to recover from abdominal surgery?
explainlikeimfive,ELI5: The process of cultivating bonsai trees results in a reduction of cells being developed which then results in miniaturization of leaves and branches. Would it theoretically be possible to apply a similar process to animals or humans to make truly miniature doll-sized creatures?
explainlikeimfive,ELI5 how does blood flow in space?
explainlikeimfive,eli5: The “handshake” between dial-up modems and why it made those sounds
explainlikeimfive,ELI5 - Why are electrons in an atom stabler compared to a free electron?
explainlikeimfive,ELI5: How your body falls asleep/ the diffrent stages of sleep.
explainlikeimfive,ELI5 What is intellectualizing as a coping mechanism?
explainlikeimfive,ELI5 Newtons law of gravity.
explainlikeimfive,ELI5: if emotions are controlled by brain and heart only pumps blood then why we feel a strange pain or discomfort in heart when we are sad or worried?
explainlikeimfive,ELI5: Where does the carbon in exhaled air come from?
explainlikeimfive,"Eli5: Why do companies use the products of Oracle to store information, when they can just use spreadsheets like Excel, or make their own spreadsheet software?"
explainlikeimfive,"eli5: ""low transaction fees"" in crypto"
explainlikeimfive,"ELI5: How does investigators wearing gloves or using cloth doesn’t erase the fingerprints, whereas criminals erase it by merely cleaning the object."
explainlikeimfive,ELI5: why can't you mix old and new flour?
explainlikeimfive,ELI5: How does particles scattered in a confined space create an explosion?
explainlikeimfive,Eli5 How do you know if your allergic to X or ingredients in X that is said in tv commercials?
explainlikeimfive,ELI5 Why are physics in some games somewhat connected to running fps?
explainlikeimfive,Eli5 Why do we need complex numbers in real life?
explainlikeimfive,eli5 How does localisation of sensation work? Do the nerves have to be in the right spatial location or is it more an illusion?
explainlikeimfive,Eli5 why do opioids make people do that “standing lean”?
explainlikeimfive,ELI5: Why do insects foolishly continue to touch sticky traps when there are loads of others stuck on it already?
explainlikeimfive,Eli5: Why does the one extra chromosome cause Down syndrome?
explainlikeimfive,ELI5 what’s the difference in filming a video and speeding it up vs time lapse video?
explainlikeimfive,ELI5: How does SPF sunscreen know how long it has been on the skin and no longer protects?
explainlikeimfive,ELI5: how does cutting right a spot just behind their head supposedly kill a lobster instantly if they have a decentralised nervous system?
explainlikeimfive,Eli5: how do endowments work? Who funds entire programs?
explainlikeimfive,Eli5: Why is sodium fluoride added to the toothpaste when it's calcium fluoride that is actually helping the teeth?
explainlikeimfive,ELI5: Why do gums change colors?
explainlikeimfive,"ELI5: Does a closed knight's tour exists for every m*n board? Otherwise, what are the conditions and why?"
explainlikeimfive,ELI5: Why most mammals cannot become pregnant whilst already nursing a baby.
explainlikeimfive,Eli5 What is bioengineered food?
explainlikeimfive,"[ELI5] how does Walmart's ""Lost Children"" aging software get so close to the actual found person?"
explainlikeimfive,Eli5 How does radiation therapy actually work? Like how doesnt it break down more of the body and make the cancer worse or something like that? And does it target only cancer area or everything?
explainlikeimfive,ELI5 : Krebs Cycle
explainlikeimfive,ELI5 - The Higgs field only only interacts with particles that have both left and right chiral versions. Why?
explainlikeimfive,ELI5: what is the different between saturated and unsaturated fats and what makes one less healthier than the other?
explainlikeimfive,ELI5: Simple (?) question about black holes
explainlikeimfive,"ELI5: Why do some sodas (coke, root beer) fizz over while others (sprite, mtn dew) don’t even though they seem equally carbonated?"
explainlikeimfive,Eli5: How does a moka pot work?
explainlikeimfive,ELI5: I know some worms can turn into two worms when cut in half; do the two worms develop consciousness? Do they think seperately or as one? Can they develop two different personalities? I have so many questions.
explainlikeimfive,ELI5 Hands buzzing using power tool
explainlikeimfive,ELI5: Why dose coughing sometimes give you a really bad headache?
explainlikeimfive,ELI5: how does an oil derrick work to extract oil?
explainlikeimfive,ELI5: What's actually happening when you sprain your ankle?
explainlikeimfive,"Eli5 what’s the difference between some one in drag , and a drag queen? Do drag queens get paid ?"
explainlikeimfive,ELI5: How does mold grow on non-organic surfaces?
explainlikeimfive,ELI5: How does alcohol get you drunk and is there a tolerance difference?
explainlikeimfive,"ELI5: Why do we have e.g. nuclear waste, if mass can be converted to energy?"
explainlikeimfive,ELI5: What’s the logic behind the remainder theorem??
explainlikeimfive,ELI5: Do the phrases “Can’t you do that…” or “Isn’t it possible to do…” actually have a real grammatical meaning?
explainlikeimfive,ELI5: How do processing units (chips) work one level deeper than the simple input/processing/output flow?
explainlikeimfive,eli5 Why cant magnets repel metal??
explainlikeimfive,Eli5 CAGED system on guitar
explainlikeimfive,ELI5: if sugar is important for human body then how diabetes (high and low) is so dangerous disease for humans?
explainlikeimfive,ELI5: How does the nanocool shipper work?
explainlikeimfive,ELI5 how does burping/breathing into a bag help with motion sickness?
explainlikeimfive,"ELI5: There are infinitely many real numbers between 0 and 1. Are there twice as many between 0 and 2, or are the two amounts equal?"
explainlikeimfive,eli5: What impact has historical use of nuclear weapons had on the production of steel?
explainlikeimfive,ELI5: How do train wheels not skid or lose traction?
explainlikeimfive,ELI5: Why is asbestos so much more dangerous than other 'sharp' dusts like fibreglass?
explainlikeimfive,"ELI5; Why are some foods considered ""good"" to eat when sick?"
explainlikeimfive,"eli5, how is something an explanation but not an excuse mental health wise"
explainlikeimfive,Eli5 What's the difference between culture and stereotype?
explainlikeimfive,Eli5. What is the differbetween trademark and registered trademark?
explainlikeimfive,ELI5: Whats it called and my does water or fog move in a circle when something fast moves through it?
explainlikeimfive,eli5: The difference between integrity and morality?
explainlikeimfive,Eli5 how does Depression kill you?
explainlikeimfive,"ELI5: If most organ cells, like in the liver, are replaced every three years or so, why isn't a transplant eventually accepted by the new body?"
explainlikeimfive,ELI5: Why fatal insomnia patients are not put to rest through general anesthesia?
explainlikeimfive,ELI5: Why does an IV puncture site stop hurting after the needle/catheter is placed?
explainlikeimfive,eli5 how is sleep not sleep? what is sleep quality?
explainlikeimfive,ELI5: Why can't things be sterilized by time?
explainlikeimfive,"ELI5: what is Euclidean’s fifth postulate, and how was it refuted?"
explainlikeimfive,Eli5: How do chewable flea/tick preventatives work?
explainlikeimfive,"ELI5: What is happening when your ears ""pop""?"
explainlikeimfive,"ELI5: Why do giant animals like whales, giraffes, and elephants need so little sleep compared to small animals likes bats and koalas who need to sleep most of the time. Wouldn't a larger body need more sleep to recover?"
explainlikeimfive,eli5 - Double split experiment
explainlikeimfive,"ELI5 ""Hey Siri, How Does Multiple Devices Respond, But Only One Follows the Command?"""
explainlikeimfive,"ELI5: What is ""100% renewable clean natural gas""?"
explainlikeimfive,ELI5: Can a person with amnesia remember what they studied?
explainlikeimfive,Eli5: what actually happens when you get an adrenaline rush to make you so significantly stronger?
explainlikeimfive,eli5 Why does hand weapons dont get replaced more?
explainlikeimfive,ELI5-What are ACE2 receptors?
explainlikeimfive,ELI5: How does allergy desensitization work?
explainlikeimfive,ELI5: How do insurance companies profit?
explainlikeimfive,Eli5: Plane Seating
explainlikeimfive,Eli5 Magnetic Charging adapters
