subreddit,title
news,"Federal agents, prosecutors going after machine-gun conversion devices in Tennessee"
news,Fake viral images of an explosion at the Pentagon were probably created by AI
news,"Navy probes new allegations of drug use, sales among USS Ronald Reagan sailors"
news,"Ray Stevenson, 'RRR' and 'Thor' actor, dead at 58 | CNN"
news,Christ the Redeemer statue displays support for Vinicius Jr against racism
news,Guam braces to take a hit from Typhoon Mawar as the storm heads toward the Pacific US territory
news,Italy's Enel to invest more than $1 bln in Oklahoma solar panel factory
news,"Rick Hoyt, who became Boston Marathon fixture with father pushing wheelchair, dies at 61"
news,At least 19 children killed in school dormitory fire in Guyana
news,"12-year-old points gun at woman’s face in robbery; 6-year-old brother involved, CMPD says"
news,TikTok files lawsuit against Montana over download ban
news,Junior doctors in England to strike for three days in June
news,Pa. hunter who shot his neighbor while trying to take down deer is headed to prison
news,"St. John's Prep in Danvers evacuated after shooting report, believed to be ""swatting"" hoax"
news,DeSantis $13.5m police program lures officers with violent records to Florida | Florida
news,‘Can’t stop us’: East Charlotte restaurant vandalized hours before drag brunch
news,Anti-Putin militia claims to have overrun Russian border village
news,"David Brandt, Man Famous For “Honest Work” Meme, Dies In Automobile Accident"
news,Man loses arm in alligator attack outside Florida bar
news,US states agree breakthrough deal to prevent Colorado River from drying up
news,"Nebraska governor signs 12-week abortion ban, limits on gender-affirming care for minors"
news,"At least 20 children have died in a fire in the central Guyanese mining town of Mahdia, officials say."
news,"A 10-year-old girl spent more than £2,500 on the gaming site Roblox after changing the password on her family's iPad tablet without her mum realising."
news,Kansas farmers abandon wheat fields after extreme drought
news,Weapons expert cut from government event due to Twitter posts
news,Colombia suspends cease-fire with holdout rebel group accused of killing 4
news,"Venmo to be officially available for teenagers, although many use it already"
news,Glistening Star Cluster Captured in Hubble's Glance
news,"Weapons contractors hitting Department of Defense with inflated prices for planes, submarines, missiles"
news,States reach landmark deal on water cuts to stave off a crisis on the Colorado River
news,Fires in Canada Causing Smoky Skies in Connecticut
news,Passenger cited after hitting Frontier Airlines flight attendant with intercom phone.
news,"Mexican and South American cartels penetrating Australian border security to import tonnes of cocaine, underworld figure tells Four Corners"
news,Meta fined €1.2 billion by Irish data watchdog
news,Tinley Park carnival canceled Sunday after fights break out during teen 'flash mob': VIDEO
news,Adidas to donate Yeezy proceeds to Anti-Defamation League and other NGOs
news,San Jose Police Arrest Student Armed With Gun at Willow Glen High School
news,2 men bitten by sharks in Florida in less than 36 hours
news,Mother of 8-year-old girl who died in Border Patrol custody says pleas for hospital care were denied
news,Pa. researchers have found ‘iconic’ bird thought to be extinct for decades: report
news,Two men sentenced for planning to attack US electric substations
news,Double amputee Gurkha veteran reaches summit of Mount Everest
news,Israeli nationalists chant racist slogans on march through Jerusalem
news,BBC Documentary on Indian PM banned in India to be screened at the Australian Parliament
news,"SpaceX missions lifts off with former NASA astronaut, three paying customers"
news,"Shootout at Baja California car rally leaves 10 dead, 10 wounded"
news,"FBI, tribe's police investigating fatal shooting of tribal member by US Border Patrol agents"
news,"Bay Area- to-Hawaii plane crashes off Half Moon Bay, killing 2"
news,"Using 'he/him,' 'she/her' in emails got 2 dorm directors fired at small New York Christian college"
news,"Mount Etna volcano erupts, raining ash on Catania, forcing flight suspension at local airport"
news,Prison ordered for attempt to burn house on sex offender registration
news,Lawsuit against Sylvania Twp. PD seeks $30 million over excessive force claims
news,Fullerton police bust drug lab while searching for parents of 3-year-old wandering streets
news,Jeffrey Epstein Appeared to Threaten Bill Gates Over Microsoft Co-Founder’s Affair With Russian Bridge Player
news,"$200,000 bail set for Detroit clerk who locked door before customers were shot"
news,"Burleson man indicted after FBI finds bomb-making equipment, manifesto at home | Texas"
news,TPD finds several hundred pounds of bomb-making material in home of Tulsa man
news,Man who claimed self-defense in shooting death of Sinzae Reed avoids murder charge
news,Mexico prosecutors withdraw case against woman sentenced to prison for killing man raping her
news,Zelensky denies the fall of Bakhmut: spokesperson
news,"Dad dead, teenage children injured after grenade blast at Lakes of the Four Seasons, IN home: police"
news,‘Too toxic’: Refinery fires leave East Texas residents reeling
news,Bomb squad removes ‘small explosive device’ found in Goose Creek
news,"Russia says Wagner private army, with help from Russian troops, seized Bakhmut"
news,Race horse's death hours before Preakness extends sport's woes seen at Churchill Downs
news,"Russian mercenaries behind slaughter of 500 in Mali village, UN report finds"
news,Seattle official refuses to resign after defending convicted pedophile's nomination for board seat
news,St. Cloud FL Pride event canceled due to ‘climate of fear’
news,Man climbs BBC HQ scaffolding and hammers at statue
news,"1 killed, 3 injured in Alabama birthday party shooting"
news,"3-year-old shoots 2 people in Indiana, leading to arrest of man wanted for murder"
news,Anheuser-Busch loses top LGBTQ+ rating over its Bud Light response
news,Mexico City airport shuts down operations due to volcanic ash
news,Prosecutors refile charges against officer in 2020 protest arrest after judge dismisses case
news,Phillip Schofield 'steps down' from This Morning 'with immediate effect' | ITV News
news,"Church was “naive” over child sex abuse, says Polish bishop after report indicates 1,000 victims"
news,Mexico moving migrants away from borders to relieve pressure
news,Mike Lindell’s $5 million contest winner takes him to federal court
news,Couple get payout after water buffaloes fall into Essex swimming pool
news,Man charged with killing boy 9 years after 5-year-old was found in suitcase
news,Indigenous nation in US seeks to block billion-dollar port project in Canada
news,Syria and Assad regime welcomed back into Arab League after years of civil war
news,Justice Department wins lawsuit to end JetBlue and American Airlines alliance | CNN Business
news,"Colombian elite backed death squads, former paramilitary commander says"
news,Downtown Walgreens Killing: Drugstore Chain Cuts Ties With Security Firm After Fatal Shooting of Banko Brown
news,Kia and Hyundai agree to $200M settlement over car thefts
news,Teen girl charged with murder after classmates die from fentanyl overdose
news,Moscow bans '500 Americans' from Russia including CNN journalists
news,California Officials Investigating Loss of 30-Ton Shipment of Explosive Chemicals
news,Texas militia member sentenced to nearly 5 years in prison for attacking police during Capitol riot | AP News
news,Wisconsin man charged with hacking sports betting accounts
news,Pentagon Accounting Error Overvalued Ukraine Weapons Aid By $3 Billion
news,"Jim Brown, one of the NFL's all-time greatest players, a social activist and actor, dies at 87"
news,Utah mom accused of poisoning husband with fentanyl in cocktail took out $2 million in life insurance policies on him
news,"Mexico leader defiant after high court rules tourist train, other works not national security issues"
news,Egyptian government walks risky economic tightrope to fulfill its loan conditions to IMF
news,"FBI misused surveillance tool on Jan. 6 suspects, BLM arrestees and others"
news,US consultancy Mintz's executives leave Hong Kong after China raid
news,Sheriff orders deputies to obey watchdog request to reveal gang tattoos
news,Bezos’ Blue Origin wins NASA astronaut moon lander contract to compete with SpaceX’s Starship
news,Homeless men recruited for veteran hotel scam
news,Supreme Court sides against Andy Warhol Foundation in copyright infringement case
news,D.C. police lieutenant indicted for tipping off Proud Boy Enrique Tarrio about arrest
news,NRA sues Maryland governor after he signs gun safety legislation
news,New Caledonia lifts tsunami warning after 7.7-magnitude quake
news,Taiwan to allow same-sex couples to jointly adopt children
news,‘No one saw this level of devastation coming’: climate crisis worsens in Somalia
news,G7 agree to 'starve the Russian war machine'
news,Creepy dolls washing ashore in Texas are being used to help birds and sea turtles
news,'Astonishing' rise in Britons with an irregular heartbeat - these are the main warning signs | UK News | Sky News
news,Zelensky to attend G7 summit in Japan in person
news,98-year-old woman and her daughter among 3 victims killed by New Mexico student who fired randomly at cars and homes
news,Colombian president retracts claim 4 missing Indigenous children found alive in Amazon after plane crash
news,Apple restricts use of OpenAI's ChatGPT for employees
news,"Police investigating a report of an active shooter at DMAX plant in Moraine, OH"
news,"Danny Masterson used drugging, Scientology to get away with rape, prosecutor says"
news,TikTok users file lawsuit against Montana over first-in-nation law banning app
news,Indiana Army veteran convicted in road rage killing of Muslim man
news,Disney to close the Star Wars Galactic Starcruiser experience after less than 2 years of operation
news,Dodgers disinvite drag troupe from team's Pride Night celebration
news,"Lynn Woods fires set intentionally, officials say"
news,Mastodon bones unearthed by Michigan work crew go on display in museum
news,Parents hope to keep Tennessee school shooter’s ‘dangerous and harmful’ writings secret
news,"WSJ News Exclusive | Jeffrey Epstein Moved $270,000 for Noam Chomsky and Paid $150,000 to Leon Botstein"
news,"GRAPHIC: Parents arrested after 10-year-old weighing 36 pounds found walking to grocery store, police say"
news,FBI says it revoked security clearances of 3 agents over Jan. 6 attack
news,Journalists attacked as Israeli nationalists march chanting racist slogans in Jerusalem Day march
news,"Disney scraps plans for new Florida campus, mass employee relocation amid DeSantis feud"
news,2 teens in custody after trying to shoot student on school bus in Prince George’s County: police
news,"Suspected Pentagon leaker was warned multiple times, prosecutors say"
news,Waukesha teacher who spoke out when the school district banned 'Rainbowland' said she was recommended for termination
news,College instructor put on blast for accusing students of using ChatGPT
news,AIAA honors NASA's DART and James Webb with 2023 Premier Awards
EarthPorn,Best of EarthPorn 2022 Award Thread
EarthPorn,The first light of dawn illuminating the alien badlands landscape in Central Utah [OC] [1800x1200]
EarthPorn,"[OC] Monument Cove, Acadia National Park [7770x5183]"
EarthPorn,"[OC] Kananaskis Lakes-- Alberta, Canada [3024×4032]"
EarthPorn,"Playa Brava, Puerto Rico 🏝️ [OC][1024x768]"
EarthPorn,"Appleton, Ontario Canada [2503x3339] (OC)"
EarthPorn,Snowy Hoodoos at Bryce Canyon [5560x3707][OC]
EarthPorn,"[OC] Maroon Bells - Aspen, CO [3024x4032]"
EarthPorn,"Lake Chuzenji, Japan [OC] [6336 × 7920]"
EarthPorn,"Sunrise at Grand Teton NP, Wyoming [OC] [2400x1600]"
EarthPorn,"Rocky Mountains in Summer | Montana, U.S. [4616 x 3078] [OC]"
EarthPorn,"Blue Mountains Grand Canyon Track NSW, Australia [OC][5172x7731]"
EarthPorn,"The Ice of The Perito Moreno Glacier, Argentina. [OC] [5157x3438]"
EarthPorn,"Caldeirão Verde, Madeira [OC] [3600x4800]"
EarthPorn,Wild rock formation with tafoni weathering on the California coast (1950x2594)(OC)
EarthPorn,"[OC] Preikestolen, Norway. [4032 x 3024]"
EarthPorn,Cascada del Bercolón; Tuejar. España [2268X4032][OC]
EarthPorn,"Exploring the levadas of Madeira, Portugal [OC] [3450x4600]"
EarthPorn,"Looking back at the desolate and wild Steens Mountains Wilderness, Eastern Oregon. [2000x1333] [OC]"
EarthPorn,"The view from Astraka Mountain Hut, Greece, (OC), (5139X3322)"
EarthPorn,"Mountains in the lake. Banff National Park, Alberta, Canada. (3952x4320)[OC]"
EarthPorn,"A fallen tree on the trail in Linville Gorge Wilderness, Pisgah National Forest,North Carolina, USA [OC][3840x2160]"
EarthPorn,One of the Kawazu Seven Waterfalls [OC](5701x3207)
EarthPorn,"Mount Hood, Oregon [OC] [4000x3000]"
EarthPorn,The Mtirala National Park waterfall in Sakartvelo [OC] [1104x1708]
EarthPorn,GNP MT USA [OC] [4272x2848]
EarthPorn,"Grand Teton National Park, [OC] [4032x3024]"
EarthPorn,"Lamgmanalogar, Iceland (5261x2361) [OC]"
EarthPorn,Icelandic roadside reflections [OC][6969 x 4644]
EarthPorn,"Pumphouse Wash, Coconino National Forest, Arizona [OC] [5856x9801]"
EarthPorn,Standing on top of Kauri Pass( 4265 meters). It’s in the Indian state of Uttarakhand and the closest road head is Auli. [OC] { 4032*3024}.
EarthPorn,"Skógafoss Waterfall, Iceland (5616x3744) [OC]"
EarthPorn,"A Few Days Til the Ice Breaks Off. Yellowstone Lake, WY. [2500x1655] [OC] @seanaimages"
EarthPorn,"Ferns sprouting in a temperate rainforest, Lynn Canyon, Vancouver BC [OC][2001x3000]"
EarthPorn,Arizona Desert Sunset 4032x3024 [OC]
EarthPorn,"Waimea Canyon, Kauai [OC] [4888x2749]"
EarthPorn,"A Blue Ridge Mountains sunset, NC [OC][3246x5096]"
EarthPorn,"Castle Mound Pine Forest, Black River Falls, Wisconsin (4000x5000)(OC)"
EarthPorn,(OC) Scottish sea cave. (3908x5212)
EarthPorn,"Spring Waterfall in Zion National Park, UT, USA [OC][2832x4240]"
EarthPorn,"Monument Rocks, Lewis, Kansas, USA [1920x1280] [OC}"
EarthPorn,"Bluebell wood at Coton Manor, Northamptonshire UK [3456x4028] [OC]"
EarthPorn,Patagonia Argentina [1200x1600] (OC)
EarthPorn,Mt Hood from Sandy River [3024x4032] [OC]
EarthPorn,"Jordan Pond in Acadia National Park, Maine USA (4032x3024) OC"
EarthPorn,Summer in the Adirondack Park of NY [OC] [5344x3640]
EarthPorn,Yosemite Creek to Sentinel Dome [OC][2732 × 4096]
EarthPorn,"Virgin Falls, Vancouver Island (OC) [4763 x 4000]"
EarthPorn,Namibian dunes [OC] [2800 × 3500]
EarthPorn,"Driftwood on the beach at Point Nepean National Park, Mornington Peninsula, Victoria [2048 x 1325}"
EarthPorn,"A Natural Window of The Beautiful Blue Ridge Mountains, Virginia [OC][2500x1608]"
EarthPorn,"Wind River Range, Wyoming [OC] [2400X1600]"
EarthPorn,"Baltic sea shoreline, Germany [OC] [5472x3648]"
EarthPorn,Iceberg Lake Mount Baker Wilderness WA USA [OC] [2814x2144]
EarthPorn,"Greenwood State Beach, CA [4032x3024] [OC]"
EarthPorn,"Touched by sun rays, Patagonia, Chile [OC][1080x1350]"
EarthPorn,"Borenore Caves, Australia (1600x740) [OC]"
EarthPorn,"Rainbow Falls, NY [OC] [1366x2048]"
EarthPorn,"[OC] Manali, Himachal Pradesh, India [5326 x3847]"
EarthPorn,"Peyto Lake, Alberta (9000x2812) (OC)"
EarthPorn,"Sonoran Desert, AZ, USA [4000 x 3000] OC"
EarthPorn,Grand Canyon West [OC] [4032x3024]
EarthPorn,"Oeschinensee, Kandersteg, Switzerland [OC] [10967x3816]"
EarthPorn,"Saguaro National Park - near Tucson, AZ [OC] [3024 x 4032]"
EarthPorn,"Las Dolinas, Mendoza. Argentina [OC] [480x1040]"
EarthPorn,"[OC] Oxbow Overlook, Theodore Roosevelt National Park ND [8064x6048]"
EarthPorn,"The mini waterfall barons haugh, Scotland (1920x1280) (oc)"
EarthPorn,"The colour of mountain, Nainital, U.K, India [3080 X4028][OC]"
EarthPorn,"Cape Perpetua, Oregon (2467x3388)(OC)"
EarthPorn,The Towers of Torres del Paine. [OC] [5333x3555]
EarthPorn,"Sunrise at Banff National Park, Alberta, Canada (1960x4032)(OC)"
EarthPorn,"Early summer beauty in Mount Rainier National Park, Washington [OC][1251x2097]"
EarthPorn,"Shirahige Falls with Blue Water River in Hokkaido, Japan - OC [3926x2224]"
EarthPorn,"Central WA, USA [OC] [6720x4880]"
EarthPorn,"Swirling Sands, Death Valley, California[OC][1080x1350]"
EarthPorn,"Cerro Torre, El Chalten [oc] 2500x3750"
EarthPorn,"Bay of Islands, Mornington Peninsula, Victoria [2048 x 1243]"
EarthPorn,"Shiprock, New Mexico, USA (3000 x 5333)"
EarthPorn,"My view while hiking to the highest point of Sedona, AZ[6960x4640][OC]"
EarthPorn,"Saskatchewan River Crossing, Alberta (7184x3045) (OC)"
EarthPorn,"Watkins Glen State Park, New York [OC] [2048x1214]"
EarthPorn,"Lone pine peak catching some beautiful morning light, California (2048x1367)(OC)"
EarthPorn,"Four Peaks, Arizona [OC] [3174x4761]"
EarthPorn,"Sunrise over a sea of clouds in Nongjrong, India. [2626x3144] [OC]"
EarthPorn,"Mount Diablo Foothills, CA [4032 x 3024] [OC]"
EarthPorn,"Afternoon Shadows Reveal Dry Canyon, Cuyama Badlands ~ Los Padres National Forest - Santa Barbara County, California [1800x1500] [OC]"
EarthPorn,"Foroglio Waterfall [OC], Foroglio, Switzerland, [2000x3000] IG: Farbik 😊"
EarthPorn,"Watkins Glen State Park, New York [1189x2048] [OC]"
EarthPorn,"Your neighborhood could be full of Earthporn. Nature preserve in Raleigh, NC. [OC][3994x5543]"
EarthPorn,"A small swamp in Valais, Switzerland (4000x3000, OC)"
EarthPorn,Just got back from J-Tree. I LOVE Joshua Trees! These were massive! [2000x1005] [OC]
EarthPorn,"Blue skies above Antelope Canyon, Arizona (2607x3910) [OC]"
EarthPorn,"I went to La Palma Island to photograph the Tajinaste flowering plants, Roque de los Muchachos, La Palma (1800x1193)[OC]"
EarthPorn,"Cathedral Valley, Utah on a moody afternoon with amazing light [OC] [4902x6127]"
EarthPorn,"Sunrise on the Rocks - Palm Coast, Florida [OC][1915x1277]"
EarthPorn,"Jedediah Smith Redwoods State Park, California (4032x3024) [OC]"
EarthPorn,Svöðufoss Waterfall: The Hidden Magical Waterfall in Snæfellsnes Peninsula [4032x2838] [OC]
EarthPorn,Washington State (5184x3456) [OC]
EarthPorn,"Madison Falls in Olympic National Park, WA [OC][3024x4032]"
EarthPorn,"Book Cliffs and the Green River as it flows from Gray Canyon, near the town of Green River, Utah [1800x1500] [OC]"
EarthPorn,"Cassidy Arch, Capitol Reef National Park [OC] [3648x5472]"
EarthPorn,Moraine Lake [OC] 3900x3005
EarthPorn,"Beautiful spring sunset along the Columbia River Gorge, Washington [OC][1302x2100]"
EarthPorn,"Tromsdalstind, Tromsø, Norway [3024x4032][OC]"
EarthPorn,The rocky California coast (a little north of Bodega Bay) (2705x3024)(OC)
EarthPorn,"Rainbow Falls, New York [1025x2048] [OC]"
EarthPorn,"Lake Minnewanka, Banff National Park, Canada [OC] [2500x1667]"
EarthPorn,Milky Way Over Havasupai Falls. 6-shot vertical panorama + exposure blend. [OC] [1667x2500]
EarthPorn,"Lincoln’s Rock, Blue Mountains, Australia [OC] [4032x3024]"
EarthPorn,Looking Glass Falls in peak fall color - North Carolina [OC][1200x800]
EarthPorn,"Windflowers blooming in Goblin Valley, Utah [OC] [1500x1200]"
EarthPorn,"Dramatic Skies Over the Pali Notches, Oahu, HI [3414x4268][OC]"
EarthPorn,Chief Mountain MT USA [OC] [4272x2848]
EarthPorn,Captured a shooting star above Kebler Pass in Colorado [5408 x 3600] [OC]
EarthPorn,Between Glasgow and Skye [OC] [5501 x3590]
EarthPorn,Portal on the Oregon Coast [OC] [4032x3024]
EarthPorn,"Ruby Canyon on the Colorado River, US [OC][4854x3883]"
EarthPorn,"Mount Hood, Oregon [OC][3723x5371]"
EarthPorn,"Early morning light starting to peek over Cadillac Mountain, Acadia National Park, Maine [OC][2268x4032]"
EarthPorn,"Perito Moreno Glacier, Patagonia [OC] [2400x1600]"
EarthPorn,"Dolomiti[OC], Lago di carezza, Italia [3000x2001] IG: Farbik"
EarthPorn,"Ujëvara e Bogovës, Albania [OC] [3024x4032]"
EarthPorn,"North Vancouver, British Columbia [OC][3420x5130]"
EarthPorn,"Death Canyon | Teton County, WY | September 2022 | [OC] [5011x7667]"
EarthPorn,"Spring in the high country - near Almont, CO [OC] [1000x750]"
EarthPorn,Wetterstein Alps [3000x4000] [OC]
EarthPorn,"[OC] Shikari Devi Temple, Himachal Pradesh, India [6000x4000]"
EarthPorn,"Cloudy Day on Little Island in Hokkaido, Japan - [OC] [5392x2381]"
EarthPorn,Deep in the middle of nowhere- the Middle Owyhee canyon in SW Oregon [OC][3468x4624]
EarthPorn,"Summer sunrise in Frontenac Provincial Park, Ontario Canada [3024x4032] (OC)"
EarthPorn,"Just a tree. (Repište, Slovakia) [OC][3024 x 4032]"
EarthPorn,"Yosemite, California [3333x2439] (OC)"
EarthPorn,Mt. Fuji [OC] [9501 x 5106]
EarthPorn,"Winter Storm, Iceland[OC][1080x771]"
EarthPorn,Glacial rivers from above. So happy to finally capture this. [OC] [4633 × 3469] [Southern Iceland]
EarthPorn,Velky Gric Handlova Slovakia [OC] [2048x1365]
EarthPorn,"The Hidden Forest - (2023) Tasmania, Australia (2048x1536)(OC) photography by @mattyjameshopkins"
EarthPorn,Breath of fresh evening air in a spectacular setting. [2884x3846] [OC] [Central Finland]
EarthPorn,"Canyonlands National Park, Utah. [OC] [3024x3024]"
EarthPorn,Gloomy vibes on the Oregon Coast. [OC][4000x2668]
EarthPorn,Outside Glacier National Park [4656x3104][OC] How to improve?
EarthPorn,"Milky Way over Temple of the Sun in Capitol Reef National Park, Utah [1200x1500][OC]"
EarthPorn,"Zion national park, Utah [4000x6000] [oc]"
EarthPorn,"Glacial beauty, Chile [OC][1080x1350]"
EarthPorn,"Reflection Canyon, Utah [6720x4480] [OC] @ThatBraxGuy"
EarthPorn,"E.T at Apostle Islands, WI [3264 X 2448] [OC]"
EarthPorn,Tetons Reflection @ Grand Teton National Park [2048x969][OC]
EarthPorn,Evening in Northeast Pennsylvania [OC] 3072x4096
EarthPorn,[OC] Glacial French Alps. 2068x4032
EarthPorn,Basalt Columns and Waterfalls. Central Oregon [1620x1080][OC]
EarthPorn,Yellowstone National Park [720x960] (OC)
EarthPorn,Sisters Rocks - Oregon Coast [4000x3000][oc]
EarthPorn,Morning fog lifting off the Andes - Ecuador [OC][1080x720]
EarthPorn,"Arches National Park, Utah. [OC] [3024x3024]"
EarthPorn,I love living by the woods. Northeast US (OC)(3024x4032)
EarthPorn,"Løkken beach, Denmark [3862x2896][OC]"
EarthPorn,"Cascade Crest, Salmon la Sac, Washington, USA [4032x1816] [OC]"
EarthPorn,"Lookout Mountain Piercing the Clouds, Washington [4032x2268][OC]"
EarthPorn,Deception Pass WA USA [OC] [2848x2144]
EarthPorn,"Lake Tekapo, New Zealand [4000 x 2232] [OC]"
EarthPorn,"Sunset along the San Rafael River, Utah (2256x1284)[OC]"
EarthPorn,"Rainbow bright Helmcken Falls BC, 🇨🇦 [OC](3060x4080)"
EarthPorn,"Bucegi Mountains, Romania. [4000 x 6000] [OC]"
EarthPorn,Strange spire rising out of the Utah badlands [OC][1800x1200]
EarthPorn,"Ominous shelf cloud moving over an endless wheat field in Wray, CO [2091 x 2614] [OC]"
EarthPorn,"El Submarino, San Rafael, Mendoza. Argentina. [OC] [1040 x 480]"
EarthPorn,"Greenbrier, in the Great Smoky Mountains National Park [OC] [6240x4161]"
EarthPorn,Jedediah Smith Redwoods State Park - California (2702x3737)(OC)
EarthPorn,"“The Mini Well” Wollongong, Australia (2048x1536)(OC) photography by @mattyjameshopkins"
EarthPorn,"Green Lake, Styria, Austria [3024x4032] (OC)"
EarthPorn,"Had a blast in Cannon Beach, OR the last few days. Smuggler Cove + Short Sand Beach. [OC] [3833 x 5749]"
EarthPorn,BARILOCHE ARGENTINA [750x1125] (OC)
EarthPorn,"Looking up, Hocking Hills, OH [3000X4000]"
EarthPorn,"Isle of Skye, Scotland - Old Man of Storr [4032 x 3024][OC]"
EarthPorn,"Rainbow Falls, Meghalaya, India. The water color is due to unique minerals in the area. [1633x2439] (OC)"
EarthPorn,"Sortland, Norway [1290x2293][OC]"
EarthPorn,GRECIA ATENAS [564x1067] (OC)
EarthPorn,"Redwood National Park, CA, USA [OC][4000x6000]"
EarthPorn,"Sunset in the North Cascades, WA [4032 x 3024], [OC]"
EarthPorn,"Great Sand Dunes National Park, Colorado USA [2160x2799] [OC]"
EarthPorn,"Painted Wall, Black Canyon of the Gunnison National Park, Colorado, USA [OC][6000x4000]"
EarthPorn,"Peaceful Mountain Stream | Pagosa Springs, Co. (3200x5100) (OC)"
EarthPorn,The best possible May weather @ the Oregon Coast [OC][4000x2667]
EarthPorn,Amidst the jungle of Madeira [OC] [2223x3000]
EarthPorn,"Endless black beach, Vik, Iceland. [3468x4624][OC]"
EarthPorn,"Moody clouds encompassing a dramatic mountain near Kirkufell, Iceland [5634x3756] (OC)"
EarthPorn,Mt. Hood [OC][6000x4000]
EarthPorn,"Benagil Caves, Portugal [OC][6082x7603]"
EarthPorn,"Mt. Sopris in Carbondale, Colorado [5542x8262] [OC] @clyde_o_scope_"
EarthPorn,Lake Lucerne from Schiffstation Vitznau (4000 × 3000) [OC]
EarthPorn,"Montmorency Falls, QC, Canada [OC] [4928 x 3264]"
EarthPorn,"Zagros Mountains, Doroud, Iran 2023 [OC] [7952*5304]"
EarthPorn,"Sunrise at Three Sisters, Canmore, Alberta [OC][5790x3860][IG @wagstaffmedia]"
EarthPorn,"Aoraki/Mt. Cook National Park, New Zealand (OC) 5472x3648"
EarthPorn,"Fog And Bluebells, Buckinghamshire, UK [OC] 6000x4129"
EarthPorn,Maple Pass WA USA [OC] [3088x2056]
EarthPorn,Mt. Adam's (OC) 3456x2072
EarthPorn,Long exposure of the stars dancing around Polaris. Taken on Kebler Pass in Colorado [5408 x 3600] [OC]
EarthPorn,"The last of this year's bluebells: Barkbooth Lot, Cumbria, England, UK [OC] [6000x4000]"
EarthPorn,"Glenorchy at dusk, Otago, New Zealand [1882 x 2905] OC"
EarthPorn,"Vega State Park, CO [4000x1800] [OC]"
EarthPorn,"Top of Kearsarge Pass, CA while coming back from a resupply on the PCT [OC][6020x4024]"
EarthPorn,"Skógafoss from top, Iceland [OC] (3024 x 4032)"
EarthPorn,I was fortunate to catch golden hour in Bryce Canyon National Park {1067x1600] [OC]
EarthPorn,"Monday afternoon walk around hometown Handlova, Slovakia [OC] [6000x3376]"
EarthPorn,"Grand Mesa National Forest, Colorado, US [4000x1800] [OC]"
EarthPorn,"Sunrise @ Bridal Veil Falls, Blue Mountains Australia (2048x1536)(OC) insta @mattyjameshopkins"
