subreddit,title
Jokes,"A wife decides to take her husband, Dave, to a strip club for his birthday."
Jokes,My dad left his job
Jokes,"My wife stopped me from taking my first bite at the restaurant, saying that we need to pray first."
Jokes,I had a dream I was eating a giant marshmallow.
Jokes,Why did the run-on sentence start panicking?
Jokes,Did you hear the joke about the two dead musicians?
Jokes,The world's richest man is dying...
Jokes,What do you call a charity based in a building with no eaves?
Jokes,A couple of dog owners are arguing about whose pet is smarter.
Jokes,Two days ago I was invited for a National Sorry Day gathering.
Jokes,"The ""Sir Sandwich"" (I don't understand this joke!)"
Jokes,The Juggler
Jokes,"Why do they call dead people ""late""?"
Jokes,Have you heard of this new dance called the politician's polka?
Jokes,What did the ocean said to the other ocean?
Jokes,I Really Feel For Batteries …
Jokes,What do you call a dense plasma ball that doesn’t pick a side?
Jokes,"Upon arriving in hell, I was surprised to find a clerk asking me, “In which military would you like to serve?” Turns out Alexander the Great, Napoleon, and Otto Von Bismarck overthrew Satan centuries ago and have been fighting each other ever since."
Jokes,A man visits the bee shop
Jokes,A gay man shops for clothing online
Jokes,Vladimir Putin consulted with a fortune teller and asked: How long will I live?
Jokes,I asked a one legged woman if she wanted to be part of a threesome.
Jokes,I went to the pub last night and was steaming drunk after one pint.
Jokes,What is Sherlock Holmes' favorite type of rock?
Jokes,"I found a book at the bookstore which said ""How to solve 50% of your problems"""
Jokes,Q. Do you know what 6.9 is?
Jokes,"When they play minecraft in Mexico, what do they call the Ender?"
Jokes,What did the Uber driver say to the one-legged fare?
Jokes,"My girlfriend said, ""You act like a detective too much. I want to split up."""
Jokes,Is it true....
Jokes,"I bought my friend an elephant for his room. He said ""thanks""..."
Jokes,Do you know what moth balls smell like?
Jokes,3 Women at the Bar talk about how loose they are.
Jokes,What do you call a vegan with diarrhea?
Jokes,How to tell if a girl likes you
Jokes,Did you know that the invention of the shovel was...
Jokes,Three dogs are having a drink at a bar.
Jokes,My wife has a sexy nightgown that I like because it reminds me of one my mom used to have.
Jokes,A man walked into a bar … and stayed there my entire childhood
Jokes,Why did the idiot climb over the glass wall?
Jokes,Why do the nurses at the blood donation clinic have autocorrect disabled?
Jokes,Neil Diamond used to be called Neil Coal…
Jokes,A Soviet satellite accidentally collided with an American satellite
Jokes,I asked the park ranger if it's ok to spit in the bush
Jokes,What's Psychologists' Favorite Dish?
Jokes,My uncle named his dogs Timex and Rolex.
Jokes,"Guy : Doctor, my Girlfriend is pregnant but we always use protection and the rubber never broke. How is it possible?"
Jokes,How much a pirate charge for piercings?
Jokes,Guy goes to the doctor
Jokes,What does a cannibal do after dumping his girlfriend?
Jokes,A young boy asks an old man how he got to be so old
Jokes,What did Dean Martin scream when he bumped an eel while scuba diving?
Jokes,I was talking with my friends at lunch about marriage.
Jokes,I got into bed last night and looked up to the stars
Jokes,I was sitting on my own in a restaurant when I saw a beautiful woman at another table. I sent her a bottle of most expensive wine on the menu
Jokes,"Today I found my first grey pubic hair. I got really excited,.."
Jokes,Why are baby ants confused?
Jokes,"My wife came to me all happy, saying, “Look darling, you got me this 40 years ago on our honeymoon, and it still fits!""..."
Jokes,"Why is it that when you're looking for something, it's always in the last place you look?"
Jokes,Uranus - These a re all true BTW
Jokes,Yikes. I think my sister is getting divorce oddly related to detective comics…
Jokes,What's brown and sticky?
Jokes,Broom Bride
Jokes,"Pessimist: ""Things just can't get any worse!"""
Jokes,"Someone just called me, sneezed and hung up."
Jokes,What sound does a plane landing on a trampoline make?
Jokes,Why did the austronaut leave the party early?
Jokes,"I could’ve been the greatest athlete of all time, but a freak injury ended all hopes of going pro."
Jokes,What if Darth Vader were Dutch?
Jokes,Adult Names
Jokes,Sigmund Freud was an Olympic Gold Medalist
Jokes,What's the difference between a condom and a coffin?
Jokes,"I went through an expensive and painful procedure yesterday, having had my spine and both testicles removed...."
Jokes,What do you call a doctor who was last in his class in medical school?
Jokes,The Optimist and the Pessimist.
Jokes,What's the difference between a stud animal and a Nigerian prince?
Jokes,Joke told by my 90 year old grandma
Jokes,(hope this isn't a repost I tried searching for it but couldn't find anything.) Two men are playing golf.
Jokes,$250 For a One Night Hotel Stay
Jokes,"Sleeping next to someone you love makes you fall asleep faster, reduces depression, reduces anxiety and helps you to live longer."
Jokes,Toilet jokes aren't my favourite kind of humour
Jokes,What do you get when you scan Elijah Wood?
Jokes,Sister Mary Margaret woke up and saw from the rising sun that she was late.
Jokes,Joke from my 4 year old
Jokes,Do you know why astronauts can’t be taller than 5’11?
Jokes,A dude is lost on an ivy league campus...
Jokes,If you see a crime at an Apple store...
Jokes,"A Scotsman, an Australian and a Welshman are hanging out together on a farm..."
Jokes,What did the mob boss name his pet parrot?
Jokes,Chuck Norris used stunt men.
Jokes,How do angels cook meals in heaven?
Jokes,My wife said she wanted to name our child Eevee because she thought it would be cool to name it after a Pokemon
Jokes,What do you call a incubator robbery?
Jokes,Y'all know what amazes me the most? A thermosbottle.
Jokes,"If a cow is facing east, where is its back facing?"
Jokes,What do you call Russian currency after it's been destroyed?
Jokes,"A younger friend, upon seeing my inline skates, said that he heard that they were really big in the 90s."
Jokes,"Once upon a time, a lion announced..."
Jokes,Why did the frog take the bus to work today?
Jokes,The Definition of Politics
Jokes,Breaking News: Schrödinger's cat is ALIVE
Jokes,Why does Ariel always wear seashells?
Jokes,Little Bobby in the woods
Jokes,"A child asks his dad, ""Daddy, what are taxes?"""
Jokes,So there was this professor who was an expert on a certain rare species of a fly
Jokes,What's a Bronco's favorite drink?
Jokes,What does a vegetarian zombie eat?
Jokes,"They put Chuck Norris in Schroedinger's box, and when they opened it..."
Jokes,What does the Kennedy computer say when it crashes?
Jokes,"As a guy with dyslexia, I sometimes get on the wrong public transport on my way to work."
Jokes,God created childbirth to give women the chance to experience what it's like...
Jokes,What does a zombie with Dyslexia eat?
Jokes,"""This apple tastes like iced tea"""
Jokes,Why is the pig not used as a draught animal?
Jokes,Holmes and Watson are out camping in the woods one night
Jokes,I’m laying in bed with my wife….
Jokes,A lorry full of toupees was stolen...
Jokes,"I was told that my high blood pressure made any sexual activity risky, so I asked my doctor."
Jokes,I had a torrid affair with a mime.
Jokes,Bob the Mailman
Jokes,Two men broke into a drugstore and stole all the Viagra.
Jokes,What do you call a Jewish person who does things out of the ordinary?
Jokes,A boy was in a car with his mother and father and he asked:
Jokes,A meteorologist walks into a bar
Jokes,Have you ever heard of the brave little German boy who can only count to 3?
Jokes,Sportsman's Callenge
Jokes,What's the one piece of advice that would benefit both a tightrope walker and a guy getting a b.j. from an 85-year-old woman?
Jokes,"The military is cutting staff and decide to get rid of three generals. One from the Army, the Airforce, and the Marines."
Jokes,Did you know there is pork in Shampoo?
LifeProTips,21 million subscribers looking for the real tip in the comments!
LifeProTips,LPT Request: Morning Routines? How do you get out of bed FAST?
LifeProTips,LPT Request: What is something you wish you were told before you got married?
LifeProTips,LPT: Use the 10-10-10 rule to make better decisions
LifeProTips,LPT - Learn to say no: Be selective with your commitments and learn to say no to tasks or projects that don't align with your priorities or values. Focus on what truly matters.
LifeProTips,"LPT REQUEST: I’m a person who stresses out wondering if they have made the best decision, even the small decisions stress me out. Does anyone have any advice to help me out with this unnecessary stress?"
LifeProTips,LPT: Do not let it fester. Speak out. Assumptions are the death of truth.
LifeProTips,LPT: Clean your kitchen sink.
LifeProTips,LPT Request : how to not be oblivious to girl signs
LifeProTips,"LPT: if a liquid like a solvent comes in a plastic bottle with the little foil seal, don't peel it off -puncture it in the center so you can squeeze or drip it out for much better control over the amount dispensed."
LifeProTips,LPT: Black bears are NOT harmless.
LifeProTips,LPT: What is something you wish you were told before you got divorced ?
LifeProTips,"LPT: If you receive a cash gift on a special occasion (birthday, graduation, etc.), follow-up in your thank you with what you spent it on - a minor detail, but most people will get a sense of satisfaction knowing they were able to contribute to something that you needed or brought you joy."
LifeProTips,LPT Request: What are some unexpected hobbies or activities that have surprisingly positive mental health benefits?
LifeProTips,LPT - Never Lie At Work and Never Do Things That Will Put You In A Position To Need To Lie To Save Your Job. Eat The S**t Sammich and Move On
LifeProTips,LPT: You can disallow people from follow you through your account settings.
LifeProTips,LPT request: Severe dental fear/anxiety but desperately need dental care. Medically necessary appointment on Wednesday. How to get through?
LifeProTips,LPT - Choose your battles wisely: Not every disagreement needs to be escalated or addressed publicly. Assess the situation and determine if it's worth engaging in or if it's best to let it go.
LifeProTips,LPT - Library cards are offered for a fee to non-residents by certain libraries
LifeProTips,LPT: Pair something you don’t want to do with something you DO want to do.
LifeProTips,"LPT: With the cost of vehicles and repair going up, make sure to check that your property damaged liability rates are adjusting to this change."
LifeProTips,LPT No purchase is necessary to win any sweepstakes or giveaway
LifeProTips,"LPT: If you visit parents or adult children regularly and they live in a city you fly to, keep a suitcase with old but wearable clothes, toiletries, spare shoes, etc. stored in their basement or attic. Wear during your visit and cut down your airline luggage to one carry-on bag - or even nothing."
LifeProTips,LPT: These 3 steps can make a project/task less stressful
LifeProTips,[LPT Request] How to feel attractive / confident / like someone people want to interact with and be around?
LifeProTips,"LPT: If someone is telling you about something they already did or a decision they've already made, don't suggest alternatives."
LifeProTips,"LPT Request: No kids, what drives you?"
LifeProTips,"LPT: If someone is venting to you, ask them which of the 3 things you can do."
LifeProTips,LPT: stop shirts from itching/bothering your back/neck by snipping all corners of the tags off at a 45 degree angle
LifeProTips,LPT Request: Marriage
LifeProTips,LPT Request: How to not envy people and genuinely feel happy for their good fortune?
LifeProTips,LPT: use vanilla body spray to keep gnats at bay
LifeProTips,LPT Request: What is a really useful or fun skill that is easy to learn but not enough takes the time to do so?
LifeProTips,LPT: self awareness is everything
LifeProTips,LPT: Small Car &amp; Huge Box? Order Uber XL or Lyft XL To Transport.
LifeProTips,LPT: How to react when liquid “goes down the wrong pipe”
LifeProTips,LPT Request: Iphone notch
LifeProTips,LPT Request: How can I focus on the positives in a memory instead of the negatives when I'm feeling down?
LifeProTips,LPT: You can better manage your sleeping habits with the voice assistant tool on your phone
LifeProTips,LPT request: my washing machine keeps blowing the fuse(?)
LifeProTips,"LPT: If you throw ball with a Chuck-It for your dog every day, skip days and switch arms."
LifeProTips,"LPT Request: Dealing with Loud Upstairs Neighbors, Unhelpful Apt. MGMT."
LifeProTips,LPT Request: How to avoid blisters while running? I have decent stamina now and can do 10k 2-3 times a week. But blisters are appearing especially on toes. This is causing long breaks between the runs.
LifeProTips,"LPT: If you're sleeping on an air mattress, let some air out when not using it. Full air pressure is trying to pull the internal bulkheads apart. Reduce the pressure by letting air out, like 1/3 or 1/2. This significantly increases its useful life span."
LifeProTips,"LPT: When you feel overwhelmed with the number things you have to do, list them down in a todo list app."
LifeProTips,LPT: Write your emergency contact number inside your passport
LifeProTips,LPT: Prevent iPhone hotspot disconnects
LifeProTips,"LPT: if your stomach is upset, it is better to lay on your left side than your right side, because of gravity and the position of your stomach."
LifeProTips,LPT - Asking for much more than the salary range posted.
LifeProTips,LPT: Got a dirty kitchen counter? Consider using a plastic bench scraper to get those stuck bits off.
LifeProTips,LPT Request: App similar to github for a non-programmer to keep track of personal tasks?
LifeProTips,"LPT: If you're going to post a social picture in a workgroup chat, ensure everyone in that chat was invited to the event."
LifeProTips,LPT Request: How to deal with anger?
LifeProTips,"LPT: (Request) any tips for welcoming a very new, very shy housemate to a established household?"
LifeProTips,LPT Request: What are some hobbies or activities that help you meet people in new or unfamiliar places?
LifeProTips,LPT: Always rinse your drink cans before drinking
LifeProTips,LPT: buy a dryer that’s 1 kg or more bigger than your washing machine. Your dryer will do a better job at a “full load”
LifeProTips,LPT: abc@gmail and a.bc@gmail lead to the same inbox. You can use this to create many accounts with your email
LifeProTips,LPT - Use a binder clip to protect the head of your razor and prevent accidental cuts when rummaging through your toiletry bag.
LifeProTips,LPT What are some activities or hobbies to start that will make you productive and smart during vacation?
LifeProTips,LPT Request: practical skills and steps to wrap yourself back up when you've made yourself too vulnerable?
LifeProTips,"LPT: Put a wireless doorbell w/ camera in your safe, so that you’re immediately notified if someone opens it."
LifeProTips,LPT Request: How do you keep your back straight long enough for it to make any kind of difference to your posture’s health?
LifeProTips,LPT Request: Our older brother chose to have both of us (younger brothers) as best men. Any advice on how to open up the speech with a joke / roast about that unusual decision?
LifeProTips,"LPT: People in the depths of despair are often unreceptive to helpful advice, even when the situation has an obvious solution. Let them know you have advice for them when they are ready to hear it and. in the meantime, you will be patient and are there for support."
LifeProTips,LPT: Never store anything sharp above shoulder level.
LifeProTips,LPT: Nothing gives you more respect and dignity than admitting when you're wrong
LifeProTips,LPT Request: how to be streetsmart
LifeProTips,LPT Request: What can one do to prevent their back from being crooked and bent when they get older?
LifeProTips,LPT Request: What are some good things to do in the weeks between finishing school and starting college?
LifeProTips,LPT: On your best days be cautious of people who are looking to take advantage of you.
LifeProTips,"LPT: Remember, for better or worse, the way life is now is not how it always will be. If you're going through a rough period, sometimes the best thing to do is just be patient and wait it out. (Tips on how to manage this as painlessly as possible in comments)"
LifeProTips,LPT Request: How to make your room look luxurious without spending a lot of money?
LifeProTips,"LPT Request: Whenever i wake up my hair is insanely messy and greasy, i’ve cleaned my sheets, slept on my back, everything. I also wake up feeling gross asf."
LifeProTips,LPT How to go on a world class adventure for nearly free.
LifeProTips,"LPT: Rather than argue with strangers on social media, argue with ChatGPT instead. It satisfies the urge to be right about something without any negative consequences."
LifeProTips,"LPT: if you’re worried about your mental health, stop taking things that affect your mental health like alcohol, coffee or even sugar and then see how you feel rather than blaming yourself."
LifeProTips,"LPT - Practice digital kindness. Treat others with respect and empathy online. Avoid engaging in heated debates or spreading negativity. Instead, focus on fostering positive and meaningful connections."
LifeProTips,"LPT: Speak in different accents when talking to your Voice Assistant (Siri, Alexa, etc.) for some entertainment. They are made to understand a diverse set of accents"
LifeProTips,"LPT: If you're gas-grilling this weekend, get the replacement propane tank now!"
LifeProTips,"LPT Request: My mother is losing mobility and has Alzheimers, what are some resources or plans I should know?"
LifeProTips,LPT Request: I need a solution to get outdoor stickers to last longer.
LifeProTips,LPT: WHY DON'T GUESTS RECORD AND TAG THE HOST?
LifeProTips,"LPT: If for any reason you still have cash or coins on you, get a savings box and put it in there. Someday when you are really broke, you will be happy"
LifeProTips,LPT Request: How do I learn to look past someone's physical appearance and get to know the whole person?
LifeProTips,"LPT request: my voice is shaky, raspy and dry?"
LifeProTips,"LPT: If you don't know what a term means, look it up, every time."
LifeProTips,"LPT if someone you know is grieving someone, or going through some sort of Crisis"
LifeProTips,LPT - Research and learn a few basic phrases in the local language of your destination. It can go a long way in communicating with locals and showing respect for their culture.
LifeProTips,LPT: you should stop eating before you actually feel full by leaving two bites uneaten.
LifeProTips,"LPT: Every big problem is unique to you and can seem overwhelming. However, these big, unique problems are made of smaller problems that are usually quite solvable. Break the big problems up and solve the components individually to resolve the big problem. This is true for school, work, and life."
LifeProTips,"LPT request: A few weeks ago, there was a LPT that went something along the lines of, ""no matter what else is happening in your life learn to prioritize 4 things: exercise, diet, rest and.."""
LifeProTips,"LPT: If you buy something from Amazon (or anywhere really), try it out even if you don't plan to use it right away"
LifeProTips,"LPT: If you use PayPal to pay any website or app, you need to review Automatic Payments to remove lasting payment authorizations"
LifeProTips,LPT : turn off app notifications to keep off your phone
LifeProTips,LPT Request: What are the best ways of paying off high debt?
LifeProTips,LPT: It's fledgling season! Here are a few tips in case you come across a baby bird on the ground.
LifeProTips,"LPT: If you're a male office worker, don't buy short-sleeved business shirts."
LifeProTips,LPT: If you ever zone out of a conversation while your talking just end with this “when all is said and done there’s nothing left to say.”
LifeProTips,LPT always clean up broken glass right away. glass related injuries can be painful and debilitating. waiting until the end of a movie or something could mean disaster if you're barefoot.
LifeProTips,LPT: Update your Undo Send settings in Gmail from the default 5 seconds to to the max 30 seconds
LifeProTips,LPT Free websites to read books on motivation and self improvement ?
LifeProTips,LPT - how to prevent shoes from squeeking?
LifeProTips,LPT Request: Short-Term/Temporary Health Insurance
LifeProTips,"LPT: Emphasizing different words when saying ""I didn't say you stole that"" can convey six different messages. Keep this in mind when having an important conversation via text."
LifeProTips,LPT Request: Easy way to remove leaves from garden/bushesz.
LifeProTips,LPT request-How to get out of negative thought
LifeProTips,"LPT request: How do I stop putting out a ""walk all over me"" vibe and seem more assertive"
LifeProTips,LPT - Smile and make eye contact. It's a simple gesture that can make others feel acknowledged and valued in social interactions.
LifeProTips,LPT: Want to create or enforce a habit? Buy something nice for yourself related to what you want to achieve.
LifeProTips,LPT Request - how to enable important notifications on certain apps?
LifeProTips,LPT: Turn your phone display to grayscale to encourage less use.
LifeProTips,LPT: Remember that you can simply buy a relatively cheap antenna and get many local TV channels.
LifeProTips,"LPT When travelling with lots blankets, roll them up and stuff them in a pillow case to save space."
LifeProTips,LPT Request: How to keep toothpaste gunk from building up in sink drain?
LifeProTips,LPT Request - I’m homeless and need a place to legally be at. How can I buy land fast without a bunch of headaches?
LifeProTips,LPT: Do not commit to someone unless you are 100% sure they are the best you can do
LifeProTips,"LPT Request - My son is ADHD and likes to fidget a lot. He spends lots of time on his phone with ""time waster"" games. Is there anything he can do on his phone instead of games that is constructive, or where he may learn something?"
LifeProTips,[LPT Request] Low-speed internet soon
LifeProTips,LPT Request YT shortcut for skip ahead while fullscreen gaming
LifeProTips,"LPT: If you keep your cheese refrigerated, let it come up to room temperature before you eat it. It will be much more flavorful."
LifeProTips,"LPT: skip the perfume before you get on a flight, a bus, or any other enclosed space with strangers."
LifeProTips,LPT: Do a routine check to make sure your dash cam is working
LifeProTips,"LPT: If you haven't changed your car insurance in a few years, call them to see what they are charging you and for how much estimated mileage per year. Since the pandemic, if you are working from home a lot, you probably use your car a lot less and are overpaying for insurance."
LifeProTips,LPT: Update the phone number associated with your email address.
LifeProTips,LPT: Get an air popper
LifeProTips,LPT: Only buy cotton bedsheets
LifeProTips,"LPT: When you have a bottle of liquor you haven’t used in a while and the cork is hard to get out, tip it upside down for a bit."
LifeProTips,LPT always carry a teaspoon
LifeProTips,LPT: keep your mouth closed when placing thumb tacks above your head
LifeProTips,"LPT - Take regular breaks and practice eye exercises to reduce eye strain. Follow the 20-20-20 rule: Every 20 minutes, look at something 20 feet away for 20 seconds to give your eyes a break from staring at the screen."
LifeProTips,LPT 5 simple things to do that will get your life on track?
LifeProTips,"LPT Request: We have a newborn son, what can we do now to make life better / easier for future him?"
LifeProTips,LPT: Tips for Moving With USPS
LifeProTips,"LPT: Gotta have opposites, light and dark and dark and light, in painting. It’s like in life. Gotta have a little sadness once in awhile so you know when the good times come"
LifeProTips,LPT: Use a larger mixing bowl than you think you need. It takes almost no additional effort to wash and it makes whatever you're making easier.
LifeProTips,"LPT: Xfinity 10Gig Network, is it Worth it or not?"
LifeProTips,LPT Online clothes shopping
LifeProTips,"LPT - Create a ""to-be"" list alongside your to-do list. Instead of solely focusing on tasks, consider the qualities or characteristics you want to embody throughout the day, such as being patient, kind, or resilient."
LifeProTips,"LPT: how to remember the difference between ""discrete"" and ""discreet""."
LifeProTips,Lpt request: how to prevent yourself from vomiting
LifeProTips,LPT: tips for getting out of bed
LifeProTips,LPT Request: How can I get a credit card company to lower my interest rate?
LifeProTips,"LPT to make your life easier, print out your car's warning light signals so you're not fumbling around with your manual trying to figure it out."
LifeProTips,LPT: Make sure you are well hydrated before getting blood drawn. Drink at least two bottles of water one hour before for an easier experience.
LifeProTips,LPT: Broccoli and cheese in the microwave
LifeProTips,"LPT: If you are on a recorded line, speak slowly clearly for your own future sake."
LifeProTips,LPT: No one wants to hear you monologue
LifeProTips,LPT : it's easier to find information by reading lots of things and then selecting the most important ones
LifeProTips,LPT: email address for my home paid off. You should do it too
LifeProTips,LPT: Reading list
LifeProTips,"LPT request: How to earn a certain amount of money quickly and easily. Doesn’t have to be consistent and long lasting, if it earns me around 3/4k usd it’s perfect."
