subreddit,title
funny,Regarding AI-Generated Content
funny,"Subreddit of the Month [May 2023] /r/yourjokebutworse/. Know of a small, humor-based subreddit that deserves a month in the spotlight? Link it inside!"
funny,An old Cricket Wireless was turned into a chicken restaurant in possibly the most lazy/ingenious way possible…
funny,Jesus Christ!
funny,Well that mall doesn’t have to mop. The floor is getting done.
funny,stream? I prefer the sea 😏 [oc]
funny,This highway billboard.
funny,Who designed this bathroom?
funny,Support group for A-A-Ron
funny,The Dangers of Dryads
funny,My wife and kid going to a Halloween party in May 🎉
funny,Anything for a good take
funny,I think my father is regretting taking the whole family to Yellowstone
funny,Near Death Experience
funny,Gift from my wife. This is love.
funny,Rise
funny,Dad had one too many this weekend 😂
funny,I was offered sex with a 21 year old girl today.
funny,"Dog rings the bell, gets confused and barks coz ""Someone is at the door"" "
funny,Got a woody today.
funny,Alternatively you can try CPR like this.
funny,What it's like trying to buy a house
funny,My friend’s flask makes me laugh every single time
funny,"If Disney cartoons have taught me anything about old women wearing hooded cloaks, I'm giving her whatever she asks for..."
funny,144p cake
funny,Human nature 
funny,Catch me if you can
funny,Modern solutions
funny,Escape from LA staring A. Lincoln
funny,Conversation between my 70 year old dad and I tonight.
funny,how it's going
funny,Ryan Gosling in GTA V
funny,I guess they had a bad day
funny,projects with no deadline...
funny,This pumpkin is concerned about his future
funny,This version much better
funny,"Each circle is a note, first one I grabbed"
funny,Just some finishing touches before we close in the void
funny,I guess he finally had enough..
funny,Final Destination Bollywood Edition
funny,"""Salt and pepper mill"""
funny,Some small child causally showed me up at jenga
funny,In the hospital waiting room
funny,The pen my wife got from work to say thanks is a little sarcastic
funny,Evolution
funny,I can't believe I was having fun in that moment
funny,Coffee Shop [OC]
funny,He learned hacking from movies
funny,Played that out like a genius.
funny,Oh no
funny,Good News [OC]
funny,Upgraded dad joke
funny,"Run away, dodododododo [OC]"
funny,Work Smarter. Not harder.
funny,Someone special came to deliver my food...
funny,Cold blooded dunk 
funny,Can relate.
funny,The previous family to stay in the villa I am in left their Disney+ signed in. I created a new profile for them before logging them out.
funny,I found her!
funny,Alexa loses her voice
funny,My cat's workout regimen...
funny,"My wife has not been able to go to work, I think she is starting to miss the lab"
funny,A Controversial Pair
funny,Too accurate 😂
funny,I think Amazon needed a bigger box...
funny,What the Dino nuggies doin?
funny,Airport Security Check.
funny,They have a photograph of a necklace made from a megalodon tooth recently found when scanning the Titanic. They didn't even mention that they found Big Bird as well
funny,Most boring life
funny,The Golden Ticket
funny,I think I took a wrong turn onto Sesame Street. (OC)
funny,I feel this is targeted to me…
funny,Please go across the street for that
funny,"Mercer Mayer book with kid’s Post-It-note commentary, found at the town dump’s book depository."
funny,Kermit is the New York Power Hitter
funny,New Driver
funny,The Granny Glitch
funny,From my small town's Dairy Queen page...uhhhh...
funny,This used to be peacock blue
funny,Danny Don't Run by Web Soup
funny,Shopping for wool online and found the exact colour I was looking for.
funny,Why am i so stupid😂
funny,Doggo never heard opera; enlightened
funny,I am a little worried….
funny,Instructions on my new massager are very clear
funny,Funny backseat logic
funny,Just trying to take a cool video of a spider and he took a swing at me
funny,Yes he is the father
funny,My mom was on a long phone call and gave this note to my sister
funny,Not sure the best subreddit but we put googly eyes on my neighbors extracted oil tank. (Part 1)
funny,Everyone is happy to grill.
funny,"5 MG can make anything seem funny....but come on, I just had to buy them and see if anyone agreed"
funny,Head Canon Regarding the Geico Gecko and Godzilla
funny,it's my parents' anniversary today. i drew this in the card i gave them
funny,Real Christians obey speed limits!
funny,I think I need a new computer
funny,"A question from my test. RIP Uncle Owen, that's one way to put it..."
funny,Fellowship of the Ring as Dark Souls Bosses (OC)
funny,"Handicapped parking always has the best, up-close spots."
funny,Look what i just found walking in my hometown
funny,Tease ur plants
funny,Made in USA
funny,I saw this in my neighborhood.
funny,OG pre-workouts were a weapon.
funny,Peculiar plumbing
funny,Photo posted from our local Virtual Academy graduation.
funny,this chocolate brand
funny,Can’t help but feel like I’m drinking dawn dish soap instead of mountain dew
funny,We made a whoopsie on the latch hardware while building our fence 🥴😅
funny,Rough night?
funny,Amazon homepage for me today!
funny,Actors roundtable
funny,This sounds vaguely familiar. 🤔 
funny,Don’t mind if i do 🤤
funny,The new Zelda game is art
funny,"No strut, no problem. "
funny,Caught my dog mid sneeze
funny,A friendly encounter in Liverpool.
funny,Batman has no time for this
funny,And the winner is...
funny,It’s not hard to see why
funny,Her goals are beyond our understanding...
funny,"Ask dumb questions, get dumb answers"
funny,"Wink, Wink"
funny,My friends in a dnd gc (I'm Sex)
funny,Got a good laugh out of this
funny,The TV in my hotel room in San Francisco 🤣🤣🤣
funny,Dead but delicious.
funny,Where are the solar panels?
funny,I would not let your kid ride this if I were you.
funny,The Goth GFs are coming.
funny,Beyonce gives the bombastic side eye to fan with exaggerated singing
funny,Horrifically appropriate name and license plate for this plumber
funny,The employees here are amazing
funny,Priorities.
funny,Cockroach troubles
funny,"Congratulations, graduates"
funny,Mitch Hedberg on That '70s Show
funny,You Knob (OC)
funny,I might get cancelled for this one
funny,Troupé Daily - Reddit Being Reddit [OC]
funny,Dave Allen - The Legend!
funny,Knock at the door
funny,Stanley finally settles the age-old question
funny,Hello?
funny,This was supposed to be “sushi” in this episode of the original Teenage Mutant Ninja Turtles.
funny,waiting for Lady Stoneheart
funny,Me over here thinking I went to the wrong school now… I can’t even get 1 dom and BYU over here with multiple and representin’
funny,Clean exit
funny,The way my professor creates quizzes
funny,One of the most wild names I’ve ever seen
funny,Bro what 😂
funny,Unit 1 secure alpha
funny,My favorite radio commercial. Sound on.
funny,Audi voice commands
funny,It’s clovering time!
funny,Nice fuel trap sticker
funny,A Chicken showing off her khaki boots
funny,They aren't even trying anymore
funny,Cat won’t share her human 
funny,Saying goodbye to our co-worker today!
funny,The cat harvest season has begun.
funny,"I went to get some Chinese food, but I think I’m at the"
funny,I would like to return these shoes!
funny,Men’s ballet tights don’t leave much to the imagination
funny,My alternative take on the most underrated scene in scary movie
funny,Apple has a sense of humor
funny,Found at a diy big box store
funny,"Ordered some Graduation Decorations. ""CoRaTS"" 🤷"
funny,Actual PSA from the CDC
funny,Whatever it takes I guess 🤷‍♂️
funny,My cat risking it all for some banana oat meal.
funny,"Monty Python - ""Loretta"""
funny,[OC] Meowssion impawssible
funny,"Saw this on the road the other day... Slow down, let me check inside the truck..."
funny,Kids say the darndest things…
funny,I saw Harrison Ford this morning. Kind of underwhelming to be honest.
funny,Nom nom nom 
funny,I have solved the energy crisis
funny,What's your name sir?
funny,Scenes from the last remaining VCR repair shop
funny,Connection Unsuccessful
funny,Peak Productivity
funny,Amigone Funeral Home
funny,"This ad popped up in Oslo, Norway, where over 4.000 American sailors from the USS Gerald R. Ford are set to enjoy their shore leave this weekend."
funny,Publix has all you need
funny,if you put it that way
funny,Poor Carol
funny,the youth…
funny,Made me hoppy
funny,"""I don't have friends, I have family."""
funny,Swedishness
funny,Either a very good or very bad night on a scooter in Atlanta
funny,"Shake it, shake it!"
funny,PSA: Be Warned
funny,Toilet sign in a Japanese cafe
funny,table tennis
funny,"I’m sorry, what kind of pizza?"
funny,From my local morning news show. Looks like he knows what he’s doing.
funny,"I wrote my own rendition of Eminem's ""Stan"" about my favorite DBD twitch streamer (very long read but worth it)"
funny,The cure for writer’s block is sometimes just laxatives.
funny,Drove behind this fine gent today
funny,"Bloodsport, the fresh maker. "
funny,(OC) How to clean your dogs bum
funny,Walmart...
funny,MOFIT
funny,He tries to eat everything I have!
funny,Just let me drink my coffee in peace man!
funny,What Is Love (Jim Carrey Edition) [HD]
funny,I’m picking up some old equipment from a local school and they played “Peaches” by Jack Black on the intercom between periods
funny,I’ve got it!
funny,I just wanted to eat a normal egg...
funny,Odd selling point for a vacuum...
funny,Coming to Netflix this Summer.
funny,Lorem Ipsum tastes fresh today
funny,Can’t shit in peace
funny,A story in two parts
funny,Best mechanics in the tristate area.
funny,The circle of life at my local tractor supply co.
funny,Never worn
funny,Neuter your Pets
funny,"Looking for stock photos, and…"
funny,Well shoot. Thanks cookie.
funny,Be careful googling this guy
funny,On my Street Today...
funny,the new Mario kart sounds dope (sound on)
funny,1948 advertising
funny,Hey! The Assman's in town!!!
funny,Is both an option?
funny,I made a fake horror movie trailer about... the eggs in my fridge.
funny,I cracked this egg open and it told me “no”
funny,"In the end, dad definitely went to look for a sandal"
funny,Anticipation
funny,Making Videogames goes wrong...
funny,Trying to be as clear as possible to my family not to use my fabric scissors. The sharpie and ribbon weren't enough.
funny,MAX A BOOM
funny,These game ads getting outta pocket
funny,Interesting way to water a plant
funny,We’ve all been there 🤷‍♂️
funny,1900s Shakespeare relief at my local children's museum has seen some crazy sh*t.
funny,That's what she said.
funny,Visiting Africa
funny,Pizza Nuggets 1993 🍕 - AI Generated Commercial 😋🍟👀
funny,Wasabi Induced Slow Motion
funny,I know this shit! 
funny,Overdramatic husky 😂
funny,Nothing but peanut butter
funny,Pepe Pepper
funny,"IMHO, the most underrated scene in Scary Movie 😂"
funny,This Training Day remake is wild
funny,My cereal came with some sound life advice
funny,Hot digginy dog!
funny,A Man's bff doggo
funny,"Uhh, um...I'll choose ticket officer."
funny,Whaaa I feel good!
funny,At least! 
funny,Belgium mailboxxx
funny,"Kids, please try this home"
funny,Wanted to draw a heart smilie and everyone just sees tits and balls
funny,Feeling called out by command prompt
funny,Kitty attack
funny,Doing some work at a nursing school and I find this fella.
funny,Lesson learned
funny,We just had twins!
funny,I asked him make a cut... It was wrong... He said he measured it with his good eye.
funny,My dad is prouder of his internet than his own son.
funny,New Yorkers
funny,(Sound on) foster kitten Cheeto gets a bit too excited about her toys sometimes. My cat CornNut just doesn’t want to deal with it.
funny,And still it's his fault
funny,Coolest dog ever
funny,Staff on the last day of School.
funny,"He'a introducing himself, be nice"
funny,I SAID NO WASABI!!!!!!
funny,Saw this at the pet store. The past tense concerns me...
funny,Ain't no educational signs gonna stop the second guy!
funny,(OC) sex DND
funny,I just Wile E. Coyote'd myself in the face with a dolly.
funny,I guess I can wait
funny,"Geography Schoolbook has an Image ofJupiter's Moon's Surface, Containing an Armadillo??"
funny,You can never be too careful with germs these days. We had better stock up!
funny,What’s dean got to do with it?
funny,“I’m on top of the liquor” - Mr. Lahey
funny,"So humans can improve mood by forcefully smiling, right? Would we be able to improve dogs' mood by wagging their tails ourselves?"
funny,"""Nuthin to see here, HONEY. Y'all keep movin..."""
funny,The Mom Song (William Tell Momisms) by Comedian Anita Renfroe
funny,It’s a milk crater
funny,Things AI CANNOT do! (my new hobby comic series)
funny,He goes to lots of concerts
funny,"Expected to roast, but got roasted instead."
funny,they should really clamp down on that behaviour 👀 [oc]
funny,[oc] Burger Bit
funny,To fall alseep to a podcast
funny,Short scene from African mortal kombat 
funny,Cutest way to die!
funny,Snoop Dogg reacting to me ruining his song
funny,Happy
funny,Local wildlife catcher's AD. 
funny,My teacher wife had outgoing students write letters to incoming students
funny,Might need a new tire!
funny,Always need to raise it..
funny,They choose the right reporter for this.
funny,Get Lootin'!
funny,Thank you for specifying
funny,Chihuahua vs. Squishmallow: Rollo vs. Carmelita
funny,"Nice shades, bro"
funny,A cake made for my 3 year old's teacher. My wife wants to know if she's a bad person.
funny,"Party Dude, an (accidental) homage to deliberatelyburied comics"
funny,This went well
funny,Horoscope for all the horny ones out there
funny,The only grocery store where the owner asks to speak to herself.
funny,Pet Insurance (oc)
funny,did I just find the first ever photobomb/troll?!?
funny,When we run out of power armor at the office
funny,My boy Moose
funny,Pick one or the other. Choose wisely.
funny,Transform
funny,"Silverback Shabani enjoying his breakfast in the rain, meanwhile, his kids despise rainfall"
funny,Unexpected
funny,elmo understands 👨🏽‍🍳
funny,I go in for my daily spanking.
funny,How to garden
funny,Metaman
funny,"If we are posting funny scary movie bits, here’s my favorite"
funny,Just found out Haribo makes this very stretchy candy. I wonder what it’s for?
funny,"""Football to the groin"" - Power ranger style"
funny,Here comes old people here comes old people
funny,league of shadows
funny,"What up, scuzzers"
funny,Fighting his own reflection
funny,My husband was obsessed with making a porn parody using hot dog weiners so here it is
funny,A tale of two Lisas
funny,Yes Indeed (OC). Weed is Very High in my forecast today.
funny,Things AI CANNOT do! ( #6 of a new comic series I started )
funny,If you have a buddy with red hair who tends to be aggressive with handling things…
funny,I need to go to bed
funny,"Bavarian Bierhouse in Milwaukee, keepin’ it real"
funny,He didn't stand a chance
funny,So this is how pencil lead is made...
funny,WTF is about to happen at my kids' school?
funny,What I imagine having a stroke feels like
funny,My new wall decoration
funny,"Dude, no way! (oc)"
funny,The New Wilhelm Scream
funny,My niece drew this. They’re just clouds okay!
funny,"Top Tina Turner Tribute, Compliments of Limmy"
funny,ding!
funny,Here's a new note
funny,Mario: an essay
funny,Final Destination’s low budget cousin Terminal Location
funny,The Mellow Show - Saturday Night Live
funny,That time we went to Olive Garden and their kids menu had an...
funny,"Dominoes now delivering to the past, present, and future! For free!"
funny,An ad that was shown to me today
funny,harmless english words that are offensive in china 🤣
funny,Proper Marketing
funny,We're totally NOT judging you...
funny,Nyuk nyuk nyuk
funny,My Son's K4 Graduation Night. 🤦‍♂️ 0 Stage Fright. 100% Getting It. 😂😂😂
funny,This is getting out of hand
funny,This is a branding strategy.. right?
funny,He didn't make it. REYKJAVIK
funny,Catch expert
funny,Partial hand amputation scheduled: what are your best jokes to help me laugh my way through this?
funny,Bom Chicka Wah Wah → One of the best commercials. Prove me wrong!
funny,I traced over a photo of myself and it still cracks me up
funny,Help wanted 🍔
funny,"Glitch In The BK Verse: ""Spider-Verse"" Whopper"
funny,"Meet Captain Over, Dunn &amp; Unger 😂 From Airplane 2 !"
funny,The kids won't get this.
funny,My friend went to a manufactured food show and these were some of the things on offer.
funny,Watch a Michigan Cowboy Tame a Runaway Cow on the Highway | New York Post
funny,Contagious laughter
funny,But what’s your other car?
funny,Sounded like an A10 warthog
funny,My Grandson graduates from elementary school tomorrow. His first grade teacher gave him a picture of one her favorite memories. He brought in Fifty Shades Freed for book day!
funny,I hate being told what to do by Amazon sellers
funny,Somebody help him! 
AskReddit,What simple mistake has ended lives?
AskReddit,What is something that young people love that you don’t understand?
AskReddit,"What do you think of people who say ""all religion are cults""?"
AskReddit,What was your favorite purchase in the last year?
AskReddit,What was “the incident” at your high school?
AskReddit,What are some green flags in restaurants?
AskReddit,What is something your country is terrible at?
AskReddit,What do you wish was real?
AskReddit,What's the dumbest thing you believed as a kid?
AskReddit,How would you feel if in order for anyone to keep their drivers license they had to take mandatory written and road test with high passing scores every five years?
AskReddit,What film released within the last decade can be considered a masterpiece?
AskReddit,What's making you angry right now?
AskReddit,"What can you get for less than $1,000 and have it last you a lifetime?"
AskReddit,You can permanently change the price of one item to $1. What is it?
AskReddit,Which movie have you watched more than any other movie in your lifetime?
AskReddit,What is the riskiest thing you’ve done in public?
AskReddit,What is the ugliest place you have ever been to?
AskReddit,"What made you finally say ""that's enough""?"
AskReddit,What do you think is the biggest mistake people make in relationships?
AskReddit,What is the male equivalent of a woman wearing a sexy mini dress?
AskReddit,What is something you regret saying to your ex-partner?
AskReddit,What is your lazy food?
AskReddit,What is never in a woman's purse?
AskReddit,How old were you when you realized that you probably weren’t going to end up with the life you thought you would?
AskReddit,What's the fastest way to lose money?
AskReddit,What’s are the signs that it’s time to look for another job?
AskReddit,What important life skill(s) has society lost?
AskReddit,What made you stay in a relationship you weren’t happy in?
AskReddit,What is the worst pick up line you’ve ever heard?
AskReddit,"Do you guys actually check people's profiles on reddit, and if so, why and when?"
AskReddit,Who is having a bad time right now?
AskReddit,When did you laugh at the wrong time?
AskReddit,Have you ever seen a ghost? What is your ghost sighting/experience story?
AskReddit,People who were adopted but parents had a biological child after. What was that like for you?
AskReddit,"If you could have sex with a fictional character, who would you choose?"
AskReddit,What is the most forgotten TV show you can think of?
AskReddit,What's the best TV show with only just 1 season?
AskReddit,What's your favourite love song?
AskReddit,What are the best qualifications to succeed in life and how to evolve them?
AskReddit,What’s your thoughts of removing pennies from American currency?
AskReddit,Who was your favorite teacher?
AskReddit,What's your favourite 'angry' song?
AskReddit,"If you are to create a new ""religion"" that is unique in every way, what would it be?"
AskReddit,Do you usually wear underwear to sleep? Why or why not?
AskReddit,What’s the best Show/Movie you have ever enjoyed Intoxicated?
AskReddit,What was the reason you had to call the police?
AskReddit,How do you like your marshmallows for s’mores?
AskReddit,What is something that you have done once but will never do again?
AskReddit,What is something you wish you were better at?
AskReddit,What TV Series that you re-watch at least once a year and what hooked you into it?
AskReddit,What is something you’re sad that younger generations won’t be able to experience?
AskReddit,What is something you did as a child that you still do now?
AskReddit,If you could only eat different variations of the same food for the rest of your life what would it be?
AskReddit,what kind of happiness can you buy?
AskReddit,What have you been snacking on lately?
AskReddit,Where were you when you heard about quarantine and did you think it would actually only be 2 weeks long?
AskReddit,What is the dumbest type of person?
AskReddit,What methods have countries used to reduce housing prices that have actually been successful?
AskReddit,"“Family Feud”, how would your family do?"
AskReddit,How do successful couples make their relationships work?
AskReddit,If money wasn’t an issue where would you want to live?
AskReddit,"What have you spent 5,000+ hours on perfecting?"
AskReddit,What are some of your best bad dad jokes?
AskReddit,Who is the woman equivalent of keanu reeves?
AskReddit,What is your favorite type of sandwich?
AskReddit,What do you guys think is the meaning of life?
AskReddit,"If you could have any fictional character as your roommate, who would you pick and why?"
AskReddit,What's the worst advice you've been given and why?
AskReddit,What puts you at peace?
AskReddit,What are songs released in the last 10 years that everybody and their Grandma even knows?
AskReddit,At what point in an acronym too long?
AskReddit,How old were your kids when they found out that meat is dead animals and how did they react?
AskReddit,What creation of yours are you most proud of?
AskReddit,"If you were the only one who knew the world would end in 12 hours, what would you do?"
AskReddit,What food has been eaten the most times throughout history?
AskReddit,"If you could change just one thing in the past, what would it be?"
AskReddit,"Who's winning game 7 tomorrow, Celtics or Heat, and why?"
AskReddit,What do you do while listening to music?
AskReddit,What’s your favorite early internet meme?
AskReddit,What advice would you give to a soon to be 40 year old?
AskReddit,What has been the biggest help or things that helped your anxiety?
AskReddit,What’s a sign you’re not as smart as you think you are?
AskReddit,What's your go to serotonin chasing activity?
AskReddit,What are your thoughts on cheaters being capable of change?
AskReddit,"What is something you still buy that costs a lot of money, even though you are on a budget?"
AskReddit,What song has become too painful for you to listen to?
AskReddit,What fast food menu item would like to see make a return in 2023?
AskReddit,What is the best strategy for dealing with stress?
AskReddit,"Street smarts of reddit, Whats most useful street tip?"
AskReddit,What song lyric gives you chills every time?
AskReddit,"People that took part in a Mr. Beast Video, how real are the ""stories"" and coincidences happening in these videos?"
AskReddit,What does GenX not understand?
AskReddit,"What is the perfect song for lying in bed at night, staring up at the ceiling, and thinking about the past, present future, life, the universe, and everything?"
AskReddit,What would be the title of your autobiography?
AskReddit,"If you could, would you want to know your death date? Why/Why not?"
AskReddit,"Theologically speaking, why did God give man nipples?"
AskReddit,What is the most unique compliment you have received?
AskReddit,Whats the most disturbing subreddit you've seen?
AskReddit,"You have a plate of rice, what two things are you adding to it?"
AskReddit,What genres would you merge with rap ?
AskReddit,what is the coolest thing you’ve ever gotten for free?
AskReddit,What is something from the 2000s that should return?
AskReddit,How patriotic are you for your country?
AskReddit,(serious) What is an interesting fact about the Cold War?
AskReddit,What's something you should never say anything bad about and why?
AskReddit,"If you had to eat 10,000 calories in one day, what would you choose to make it as easy as possible for you?"
AskReddit,What do you consider the best British film?
AskReddit,"Redditors who have been to Iceland, what were your thoughts on it?"
AskReddit,"Doctors, what's it like treating other Doctors?"
AskReddit,What is the movie quote that you will never forget and why?
AskReddit,What’s the most unbelievable fight sequence in movie history?
AskReddit,What are some mind games you play on people?
AskReddit,"If you could travel back in time, what famous battle would you choose to observe and return unscathed?"
AskReddit,"Do you feel there an active or developing affordability crisis where you live? If so, where do you live?"
AskReddit,what do you fantasize the most about?
AskReddit,Where do you get your political news from?
AskReddit,Which famous personality is most likely to be the leader of Illuminati?
AskReddit,"What, legitimately, should be considered when determining a ""living wage""?"
AskReddit,"Teachers of Reddit that buried time capsules with their students, did you ever dig them back up? If so, what interesting or nostalgic items did you find?"
AskReddit,Medical Professionals of Reddit: what’s the most unrealistic thing that happens on grays anatomy that would never happen in real life?
AskReddit,What would you want your last meal to be?
AskReddit,What’s one thing you would make illegal if you were able?
AskReddit,What was your most extreme sexual experience so far?
