subreddit,title
science,Research review shows narcissistic status pursuit and psychological defensiveness predict a key role in predicting potentially problematic political attitudes and behaviors.
science,"Air pollution particles trigger cellular defense mechanisms. The research may explain why air pollution increases a person's risk for a number of acute and chronic lung diseases, including lung cancer, interstitial pulmonary fibrosis, and chronic obstructive pulmonary disease."
science,"A new study in cells and mice has shown that a commonly used medical dye, indocyanine green, acts as an antidote for poisoning by the “death cap” mushroom, Amanita phalloides. The death cap is thought to be responsible for 90% of mushroom-linked fatalities each year."
science,"Ketamine and suicide: A retrospective controlled analysis showed that 80% of the patients had suicidal ideation (SI) pretreatment, but that after treatment, 70% of patients experienced improvement and 50% experienced no SI at all."
science,"Researchers have identified a subset of brain cells, producers of neuropeptide Y (NPY), that intensify appetite in response to prolonged high energy levels - like fat stores in obesity."
science,A unique experiment shows how multicellular organisms might have evolved from single-celled ancestors.
science,Infection with common cold coronaviruses can trigger broad cross-immunity against SARS-CoV-2 proteins
science,"Researchers have proposed a novel metric and established an open-access database enabling the direct comparison of complex natural organic matter samples analyzed using different mass spectrometry equipment. It unlocks mass spectrometry’s potential for environmental science, agriculture, and indust"
science,19.8 million acres burned—37% of the total area scorched by forest fires in the western United States and southwestern Canada since 1986—can be attributed to heat-trapping emissions traced to the world’s 88 largest fossil fuel producers and cement manufacturers
science,"Learning to save lives can start as early as age 4, according to new scientific statement | Co-authored by the American Heart Association, outlines best practices for building skills over time so kids can become lifesavers by middle school"
science,Children whose families participated in a program that helped them move from distressed neighborhoods to areas with lower rates of poverty and better public resources like schools and parks experienced significant improvements in severe asthma episodes
science,Combination of oncolytic viral therapy and immune therapy extends survival for Glioblastoma patients
science,"Plasticosis is the name of the first described disease caused by eating plastic. The disease, which was discovered during the autopsy of seabirds that suffer greatly from plastic in the environment, is characterized by severe fibrotic changes in the stomach"
science,Ketamine-assisted psychotherapy in adolescents with multiple psychiatric diagnoses
science,Empirical evidence that anarchic societies can successfully engage in military innovation: The novel case of the Ukrainian civil war of 1917–21 and the anarchist movement of Nestor Makhno
science,GWAS and meta-analysis identifies 49 genetic variants underlying critical COVID-19
science,"Researchers are striving to make earlier diagnosis of Alzheimer’s dementia possible with a machine learning (ML) model, that uses speech traits to detect cognitive decline, and could one day be turned into a simple screening tool anyone with a smartphone could use"
science,"Researchers have identified new genetic risk factors for two types of non-Alzheimer’s, the discovery provides potential clues for Lewy body and frontotemporal dementias"
science,"In a rare example of insect tool use, a species of assassin bug in Australia uses sticky resin from spinifex grass to help capture prey"
science,Homeostatic activation of aryl hydrocarbon receptor by dietary ligands dampens cutaneous allergic responses by controlling Langerhans cells migration
science,A multifunctional decellularized gut suture platform
science,"Holding self-transcendence values linked to greater satisfaction with one’s romantic relationship: Study reveals that when individuals hold self-transcendence values (equality, kindness, compassion) they are more likely to report greater relationship satisfaction."
science,"Trace amounts of human DNA shed in exhalations or off of skin and sampled from water, sand or air (environmental DNA) can be used to identify individuals who were present in a place, using untargeted shotgun deep sequencing"
science,The impact of timing of in utero marijuana exposure on fetal growth
science,"Patterns of problematic cannabis use in Canada pre‐ and post‐legalisation: Differences by neighbourhood deprivation, individual socioeconomic factors and race/ethnicity"
science,The first radiation belt outside the solar system has been spotted
science,Researchers treat depression by reversing brain signals traveling the wrong way
science,"Nano tech for better wine: new ‘smart surface’ based on applying a thin plasma polymer coating to a surface and then immobilising nanoparticles on that surface, has been shown to successfully remove unwanted sulfur aromas from wine"
science,Virtual relaxation interventions employing nature stimuli have a positive effect on the autonomic nervous system associated with relaxation as measured by heart rate variability (HRV).
science,A vicious cycle of sedentary behavior and depression may occur within romantic relationships
science,"Chronic pain occurs more often among U.S. adults than new cases of several other common conditions, including diabetes, depression, and high blood pressure. Among people who have chronic pain, almost two-thirds still suffer from it a year later."
science,Researchers discover second case of person resistant to Alzheimer’s
science,Short-term fasting lowers glucagon levels under euglycemic and hypoglycemic conditions in healthy humans (May 2023)
science,"US gun violence: half of people from Chicago witness a shooting by age 40, study suggests"
science,"Veterans exposed to chemical in water at Camp Lejeune faced a 70% higher Parkinson’s risk, study says"
science,"Newfoundland communities are ‘most Irish’ outside Ireland, genetic study finds"
science,Farmland practices are driving bird population decline across Europe
science,"Alternatives to blood donor deferral of gay, bisexual, and other men who have sex with men: Acceptability of screening the sexual risk behavior of all blood donors"
science,Epigenetic inactivation of the 5-methylcytosine RNA methyltransferase NSUN7 is associated with clinical outcome and therapeutic vulnerability in liver cancer
science,Newer Antiseizure Medications and Suicidality: Analysis of the Food and Drug Administration Adverse Event Reporting System (FAERS) Database
science,"""First cases of drug-resistant Trichophyton indotineae (tinea/ringworm) fungus in the United States"""
science,"Physical &amp; sexual abuse in childhood &amp; adolescence could be associated with a greater risk of adult premature death. Relative premature death rates were 53% &amp; 80% higher among nurses who experienced severe physical abuse or forced sexual activity in childhood &amp; adolescence. N=67,726 US female nurses"
science,Effects of resistance training on sleep of patients with fibromyalgia: A systematic review found resistance training to be superior to flexibility training and equivalent to aerobic exercise.
science,Development and implementation of an automated and highly accurate reporting process for NGS-based clonality testing
science,"James Webb Space Telescope discovers water around a mysterious comet: The study of Comet 238P/Read, which lurks in the main asteroid belt, could help reveal the source of Earth's water, a vital ingredient for life on our planet."
science,"Association between fecal incontinence (FI) and suicidal ideation in adult Americans: It was found that FI was associated with an increased risk of suicidal ideation after controlling for baseline characteristics, risk behaviors, and comorbid conditions such as depression."
science,"Surveying the body sizes of Earth’s living organisms, researchers found that the planet’s biomass – the material that makes up all living organisms – is concentrated in organisms at either end of the size spectrum: largest or smallest"
science,New evidence shows Saturn’s rings are much younger than the planet
science,Coastal properties exposed to flood risk decrease in valuation after phenomena like 2012’s Hurricane Sandy — even in northern U.S. locales spared from direct damage
science,Communities of color disproportionately exposed to PFAS pollution in drinking water
science,Research shows a significant association between eating disorders in children and adolescents and perfectionistic tendencies.
science,"Parental motivated helplessness in vaccinating children against COVID-19: Its association with fear, effectiveness and willingness to vaccinate"
science,"‘Thunder beast’ fossils show how some mammals might have gotten big. Rhino-like creatures called brontotheres evolved into both bigger and smaller forms, and the bigger forms won out."
science,Clinically relevant deficiency of the “bonding hormone” oxytocin demonstrated for the first time
science,"Air pollution from oil and gas production responsible for $77 billion in annual US health damages, contributes to thousands of early deaths, childhood asthma cases nationwide"
science,"Studying a country whose proportion of migrants has tripled in less than ten years (Chile), researchers find immigration negatively impacts people’s perceptions of crime but has no effect on actual crime rates"
science,Study Finds Fluorescent Guide Can Help Detect Tumor Left Behind After Breast Cancer Surgery
science,"New research has found that the risk of long COVID is strongly associated with area-level deprivation (lower socioeconomic status), with the odds of having long COVID 46% higher for people from the most deprived areas, compared to those in the least deprived areas."
science,Interstrand Cross Links Improve Non-Viral Gene Editing
science,Disrupted Gut Virome and Bacterial Metabolites Implicated in the Pathogenesis of Anorexia Nervosa
science,Thirteen-fold variation between states in clozapine prescriptions to United States Medicaid patients
science,Depressive Symptoms are Positively Linked to Malevolent Creativity: A Novel Perspective on the Maladaptive Nature of Revenge Ideation
science,The drug solriamfetol is the most effective treatment for excessive daytime sleepiness (EDS) for people with obstructive sleep apnea (OSA). 15 to 30 per cent of people in North America have a diagnosis of OSA and the prevalence could be much higher as many others are undiagnosed.
science,"Body Type May Give Athletes Upper Hand in Certain Climates: Taller, leaner runners with long limbs tended to excel in Ironman events held in warm climates, while marathoners with stockier builds and shorter limbs fared better in colder climates"
science,"Contrary to popular belief that the most dangerous jobs would lead to the greatest number of workplace accidents, a recent study reveals that accidents are, in fact, more prone to happen in moderately hazardous work environments."
science,"Mediterranean diet’s cellular effects revealed: fat from olive oil and nuts boosts the numbers of two key cellular structures and protects membranes from damage, lengthening the lives of laboratory worms"
science,A new capacity of gut microbiota: Fermentation of engineered inorganic carbon nanomaterials into endogenous organic metabolites (May 2023)
science,The short-chain fatty acid acetate coordinates with CD30 to modulate T cell survival (May 2023)
science,Loss of immunity is accelerated in vaccinated individuals with severe obesity — BMI &gt; 40 cohort 76% more likely to experience hospitalization or death from COVID-19
science,Newly identified species of demon catshark has eyes with rare white irises and eggs in corrugated cases
science,"More than half of popular fitness influencers on Instagram are pushing harmful content about body ideals, exercise. Most of these accounts show thin and athletic women promoting exercise, fitness. Some feature men with chiseled abs and body-builder-esque physiques."
science,Restoring control to a particular brain region may help to prevent return to use of opioids: Researchers have found a new way to reduce return to the use of opioids in a preclinical model.
science,Competition between Energy and Dynamics in Memory Formation
science,"Individuals who strongly subscribe to self-essentialist reasoning tend to extrapolate shared worldviews from singular common interests, which can lead to unwarranted assumptions and potentially limit the range of their relationships due to minor disagreements."
science,Human metabolome variation along the upper intestinal tract (May 2023)
science,Novel COVID-19 vaccine could provide longer-lasting protection against SARS-CoV-2 and emerging variants — with lifelong protection a possibility
science,Existence of infinitely many minimal hypersurfaces in closed manifolds
science,COVID-19 during pregnancy may increase obesity risk in children
science,A little narcissism may be a good thing in leadership roles: Test of an inverted U-shaped relationship between leader grandiose narcissism and follower satisfaction with leader.
science,Spatially resolved multi-omics highlights cell-specific metabolic remodeling and interactions in gastric cancer (May 2023)
science,"[Semaglutide, aka Wegovy, Rybelsus, Ozempic] therapy in people with obesity restores natural killer cell metabolism and effector function [boosting cancer suppression]"
science,"In one lake deep under Antarctica’s ice, microbes feast on ancient carbon. The find adds to existing evidence that, during a period of warming about 6,000 years ago, the ice sheet in West Antarctica was smaller than it is today."
science,Pancreatic Cancer Vaccine Shows Promise in Small Initial Trial
science,Long distance multiplexed quantum teleportation from a telecom photon to a solid-state qubit | Nature Communications
science,"Higher levels of psychopathic traits are associated with a higher utilitarian tendency, says new research."
science,No Appreciable Effect of Education on Aging-Associated Declines in Cognition: A 20-Year Follow-Up Study
science,Evidence of motor intentions in plants: A kinematical study.
science,"Hammerhead sharks are first fish found to ‘hold their breath’. Because it makes them better hunters, scalloped hammerhead sharks (Sphyrna lewini) have evolved a unique method to avoid losing body heat when they dive for prey in deep, cold waters: they close their gills."
science,Earth’s upper atmosphere is a sensitive explosion detector | Technique used to pick up ripples from nuclear blasts could also monitor earthquakes and eruptions
science,Societies that believe in supernatural punishment and monitoring do not have more cooperative behavior.
science,The effect of climate change on avian offspring production: A global meta-analysis
worldnews,"/r/WorldNews Live Thread: Russian Invasion of Ukraine Day 465, Part 1 (Thread #606)"
worldnews,Chinese warship nearly hits U.S. destroyer in Taiwan Strait during joint Canada-U.S. mission
worldnews,"Le Pen’s far right served as mouthpiece for the Kremlin, says French parliamentary report"
worldnews,"Fed up with corruption, North Koreans are attacking police, secret document shows"
worldnews,"Over 60,000 Ukrainian women are defending their country – Ukraine’s Defense Ministry"
worldnews,India Cuts Periodic Table and Evolution from School Textbooks
worldnews,Putin’s press secretary says Russian leader wants to achieve his goals by means other than war
worldnews,"Slovakia risks succumbing to Russian disinformation, president warns"
worldnews,Berlin calls on China to stop enlisting former German military pilots
worldnews,Zelenskiy says Ukraine ready to launch counteroffensive
worldnews,Lecture on Holocaust in Poland canceled after far-right lawmaker storms podium
worldnews,"Taiwan war would be 'devastating,' warns US Defense Secretary Lloyd Austin as he criticizes China at Shangri-La security summit | CNN"
worldnews,World's first and only all-white panda captured in China's Wolong Nature Reserve
worldnews,Humpback whale freed after gruelling eight-hour rescue mission in Australia
worldnews,China rejects US economic sanctions over fentanyl crisis: ‘They are trying to blame us for their own problems’
worldnews,A Ukrainian drone maker said they're building drones that can carry out surprise attacks to target Russia's 'very expensive' equipment
worldnews,Switzerland has highest proportion of people not identifying as male or female
worldnews,"Armenia is not Russia's ally in Ukraine war, says PM Pashinyan"
worldnews,"Labour needs an ‘honest debate’ about Brexit damage, union warns"
worldnews,Ukraine says inspections found nearly a quarter of its air-raid shelters locked or unusable
worldnews,'Frightening': thousands of Russians flee shelling to Belgorod
worldnews,Zelensky: 'We are ready' for counteroffensive
worldnews,"China objects to NATO labelling it a ""threat"" - embassy"
worldnews,Scientists Successfully Transmit Space-Based Solar Power to Earth for the First Time
worldnews,"Ukrainian drone operator dodges Russian TOR-2M missile, then catches up to it"
worldnews,Germany: Greens demand higher fees for flights with private jets
worldnews,Wagner boss says Russian forces laid mines to harm his fighters
worldnews,"Rodolphe Jaar, mastermind of assassination of Haiti president Jovenel Moïse, sentenced to life by US court"
worldnews,"Russians hit suburbs of Dnipro: 13 injured, including child, people under rubble"
worldnews,"As anti-gay sentiment grows, more LGBTQ+ people seek to flee Uganda"
worldnews,Plastic pollution: Key step toward landmark treaty to end plastic waste
worldnews,Experts warn bird flu virus changing rapidly in largest ever outbreak
worldnews,"Police arrested four people in Hong Kong for ""seditious"" acts and ""disorderly conduct"" on Saturday, on the eve of the 34th anniversary of the Tiananmen Square crackdown"
worldnews,Google Evacuates Mexico City Offices After Reported Bomb Threat
worldnews,"Halifax-area wildfire 85% contained and not expected to spread, officials say"
worldnews,'Utterly deplorable': SNP MP blasts UK's slashing of support for Ukrainian refugees
worldnews,Greenland unveils draft constitution in push for complete independence from Danish control | PBS NewsHour
worldnews,"At least 120 dead, 800 injured in train accident in Odisha, India"
worldnews,Biden and Danish PM to discuss training of Ukrainian pilots on F-16s
worldnews,"Cornered in Ukraine and isolated by the West, the Kremlin returns to Cuba"
worldnews,"Japan, U.S., South Korea to launch system to share North Korea missile info"
worldnews,"Germany: Police break up banned far-left protest in Leipzig. Left-wing protesters wanted to gather to protest a jail term given to a woman for attacking neo-Nazis. Despite court bans, police first tried to accommodate the protest, but broke it up when officers came under attack"
worldnews,"Pakistan's inflation soars to record 38%, surpassing Sri Lanka's"
worldnews,Taiwan urges China to embrace democracy ahead of Tiananmen anniversary
worldnews,"More people than ever are looking for a flatmate, with more 55+ people searching in Australia"
worldnews,"Swiss parliament blocks German, Dutch, Danish plan to supply over 100 tanks to Ukraine"
worldnews,Two IDF soldiers shot dead in Egypt border guard post; gunman killed in later clash
worldnews,"Tens of thousands gathered on Saturday for the fifth anti-government protest this month in Belgrade after two back-to-back shootings that killed 18 people, half of them children. The ""Serbia against violence"" protests are some of the largest rallies since the fall of Slobodan Milosevic"
worldnews,AfD soaring: Far-right party at new high as climate issues split Germany
worldnews,"Hong Kong Tiananmen crackdown activists, artists taken away by police on eve of anniversary"
worldnews,Three IDF soldiers killed in shootings carried out by Egyptian guard
worldnews,Ukraine war: Twenty injured after Russian strike on Dnipro
worldnews,"Georgia's EU candidate status would help EU security, boost the bloc's regional influence and help democracy in Georgia, president says"
worldnews,Pope warns of risk of corruption in missionary fundraising after AP investigation
worldnews,Belarus’ Lukashenko: ‘The only mistake we made’ was not finishing off Ukraine with Russia in 2014
worldnews,"Russia deployed its feared thermobaric missile launcher on its own territory to repel an attack by insurgents, UK intel says"
worldnews,Newly discovered stone tools drag dawn of Greek archaeology back by a quarter-million years
worldnews,China tightens security on 34th anniversary of Tiananmen protest
worldnews,Moscow loses a cultural battle as Degas’ ‘Russian dancers’ recognized as Ukrainian
worldnews,Forest fires force thousands out of their homes in Quebec in the North Shore
worldnews,Blinken says no Ukraine cease-fire without a peace deal that includes Russia's withdrawal
worldnews,Canada-Poland alliance bolsters Ukraine’s defense training
worldnews,"Japan, US, Australia to expand joint drills focusing on East, South China seas"
worldnews,"US says more nuclear arms not needed to deter Russia, China"
worldnews,Humza Yousaf: There's 'never been a more important time' for Scottish independence
worldnews,"US, allies clash with Russia, China over North Korea's failed military spy satellite launch"
worldnews,The VP of the European Parliament: Bulgaria has done its Homework for Schengen
worldnews,Three IDF soldiers killed in shootings carried out by Egyptian policeman
worldnews,Turkey to send commando unit to help quell unrest in Kosovo
worldnews,Kyiv missile strikes: Tracking the rise of Russian attacks
worldnews,US Secretary of State Blinken said peace talks shouldn't happen in Ukraine until Kyiv is strong enough to do it themselves
worldnews,"Russia used ""starvation tactics"" against Ukraine civilians, investigators claim in new war crime allegation"
worldnews,"Indonesia proposes demilitarised zone, UN referendum for Ukraine peace plan"
worldnews,Israeli MKs call to change Egypt open fire rules after attack
worldnews,"Lebel-sur-Quévillon in northern Quebec evacuated, as wildfires rage across Quebec"
worldnews,More than 800m Amazon trees felled in six years to meet beef demand
worldnews,Agro giants buy grains from farmers fined for using Indigenous land in Brazil
worldnews,PM Viktor Orbán receives Russian Order of Glory and Honour
worldnews,Ukrainian Foreign Minister is outraged by slow introduction of sanctions against manufacturers of Russian drones and missiles
worldnews,Officials Find 45 Bags Of Human Remains In Mexico
worldnews,"The world should see the first draft of a highly anticipated and much needed international treaty to combat plastic pollution by the end of November, 175 nations gathered in Paris decided Monday after five days of gruelling talks"
worldnews,"World’s wheat supply at risk of shock due to climate change, study warns"
worldnews,"Rastafari gain sacramental rights to marijuana in Antigua and Barbuda, celebrate freedom of worship"
worldnews,BRICS open to enlargement in call for 'multipolar' world
worldnews,Twitter user discovers strange anti-Ukrainian ad on Israeli Facebook
worldnews,Bulgaria: March Against President Radev and Russia’s Influence in Bulgaria Takes Place in Sofia
worldnews,"Russia to come back to START if U.S. abandons its 'hostile stance,' foreign ministry says"
worldnews,India train accident: Modi vows punishments over deadly Odisha crash
worldnews,"Kosovo 'Tactical Game' Is A Strategic Blunder, Security Expert Charles Kupchan Warns Amid Balkan Violence"
worldnews,Judge rules elite Australian soldier killed Afghans as suit fails
worldnews,Scientists discover mysterious cosmic threads in Milky Way
worldnews,Black Sea urchins have disappeared from the Gulf of Aqaba. Their loss could kill off an entire coral reef.
worldnews,Swiss capital city wants to test controlled sale of cocaine
worldnews,"Sudan fighters take over Khartoum museum, director says"
worldnews,"Iran pushes for naval alliance, claims Gulf countries may participate"
worldnews,Turkey's Erdogan urges unity as he begins new presidential term
worldnews,Senior UAE official defends oil industry's role at UN climate summit that Gulf nation will host
worldnews,Polish constitutional court confirms president’s pardon of government minister
worldnews,"US Secretary of State Blinken hails Finnish 'sisu', calls Russia's war in Ukraine a ""strategic failure"""
worldnews,Tensions remained high in Senegal on Saturday after fresh overnight clashes brought the death toll to 15 in the two days since a court convicted opposition leader Ousmane Sonko
worldnews,NATO official calls for transparency over nuclear weapons
worldnews,A Compact Fusion Reactor Barely 3 Feet Across Has Hit a Huge Milestone
worldnews,Imran Khan’s political games leave him isolated as Pakistan army destroys party
worldnews,Japan vending machines to automatically offer free food if earthquake hits
worldnews,EU raises bar for punishing countries that help Russia beat sanctions
worldnews,"Indonesia proposes demilitarized zone, UN referendum for Ukraine peace"
worldnews,Two wounded in 'security incident' along Israel-Egypt border -Israeli military
worldnews,"Calm situation in the north of Kosovo, the mayor of Leposavic still inside the Municipality"
worldnews,Treason trial of Russian hypersonic missile scientist begins
worldnews,Cairo sandstorm turns sky orange and kills at least four
