subreddit,title
Showerthoughts,"Gardening seems to mainly be about identifying the plants that are best suited to thrive in your local climate, environment and soil-type, then calling them weeds and trying to replace them with less suited plants."
Showerthoughts,Butt implants are a convoluted way to shove money up your ass
Showerthoughts,We each have over 1 million great-great-great-great-great-great-great-great-great-great-great-great-great-great-great-great-great-great-grandparents.
Showerthoughts,There are species in the ocean that will go extinct before we ever discover them.
Showerthoughts,The day will come when people will find it hard to believe we were actually allowed to drive cars ourselves.
Showerthoughts,"Baby unicorns must be hornless at birth, and indistinguishable from a regular foal."
Showerthoughts,It's not gonna be too long until VR porn and Neurolink combine.Then it's lights out for humanity.
Showerthoughts,The Wizard of Oz is an isekai
Showerthoughts,Dogs have no concept of money and yet have worked out an entire barter economy of love for food
Showerthoughts,Thanks to the rise of food delivery service married men everywhere can eat Hooter’s wings again.
Showerthoughts,Dog breeds are GMOs.
Showerthoughts,"More funds are raised to solve poverty, than ever goes into solving poverty."
Showerthoughts,"Bugs having the whole space of earth to explore, and then they hit your car."
Showerthoughts,"In the future, your great grandchildren, great great, and even 5 generations past will be able to see your online posts, profiles and digital footprint."
Showerthoughts,"There is a weight class for sports like boxing, but no height class for sports like basketball"
Showerthoughts,The average man knows how to give a better blowjob than the average woman.
Showerthoughts,An eye for an eye isn't actually a bad philosophy when fighting a cyclops
Showerthoughts,"While having good memory is considered a positive thing, we are very lucky that we don’t constantly remember everything that has ever happened to us"
Showerthoughts,Peeling the potatoes isn't the hard part. The real hard part is holding onto them during.
Showerthoughts,"Once AI can successfully create human figures, they'll be less need for fashion models."
Showerthoughts,It's kind of interesting that balding for men is partly an indication of aging but when they shave their heads many actually end up looking younger.
Showerthoughts,In space you wouldn't have to worry about an icecream cone dripping on your hand.
Showerthoughts,All movies that are based on a true story take place in the same cinematic universe
Showerthoughts,"Pizza is packed in a square, baked in a circle, and served in triangles."
Showerthoughts,Zombies are still known for eating brains even though it’s almost never seen in popular media
Showerthoughts,Wait For It will become so overused that people will stop waiting for it.
Showerthoughts,The Rodeo Business must be booming just due to the people that have apparently all been to at least one rodeo.
Showerthoughts,Cellphone chargers in public are as pervasive as ashtrays were.
Showerthoughts,"The craziest thing about Fritos is how it’s both true that they’re delicious, and that they smell exactly like dog feet"
Showerthoughts,"Kids want to grow into their clothes, and adults want to shrink into their clothes."
Showerthoughts,Love is felt more when it’s leaving.
Showerthoughts,"Every location that's east of you is also technically west of you, albeit much further away"
Showerthoughts,GPS has all but eliminated the Shortcut
Showerthoughts,People don’t enter cities on foot anymore
Showerthoughts,A whole new generation is using the modem dial up sound as a sound effect without knowing what it is.
Showerthoughts,AI Art will show us how many people are completely fine with mediocrity in terms of content.
Showerthoughts,Smartphones might be one of the only things that don’t drastically improve with increased wealth.
Showerthoughts,It’s even more disappointing walking back to coach when there isn’t anyone recognizable in first class.
Showerthoughts,Rich people don't go broke the same way poor people do.
Showerthoughts,Fish that swim down into very shallow creeks are exploring caves.
Showerthoughts,Lunchables are MRE's for kids.
Showerthoughts,"When we depict people 100x larger, they move proportionally slower. When we depict people 100x smaller, they don’t move proportionally faster."
Showerthoughts,It’s always daytime in space
Showerthoughts,"When you're a kid, bedtime is a punishment. When you're an adult, bedtime is a reward."
Showerthoughts,Wedding videos are technically documentaries
Showerthoughts,"By definition, being happy is gay"
Showerthoughts,Aol keywords were the precursor to hashtags.
Showerthoughts,Many people don't like the end pieces of a bread loaf because of the crust but have no problem eating hotdog buns
Showerthoughts,One of the most famous songs about bananas is about how they don’t have any bananas
Showerthoughts,"There are about 8 million species of Earth, meaning there is a 1 in 1000 chance of anyone discovering one."
Showerthoughts,Rain on concrete is a scatter plot chart of where water drops will likely fall
Showerthoughts,One species‘ porn is another species‘ documentary
Showerthoughts,Window blinds adjustment cords are a form of engineering that's not really seen anywhere else.
Showerthoughts,GILF is gender neutral.
Showerthoughts,Whenever we didn’t have any language what did they think when someone did something
Showerthoughts,Old English is technically young English.
Showerthoughts,Even the meanest dog looks scared and vulnerable when taking a crap.
Showerthoughts,Rush hour is actually the hour before the vehicle masses and gridlock— when everyone is rushing to beat the high volume traffic period.
Showerthoughts,Vampires that eat human flesh and not just blood must be seen like humans that eat banana peels.
Showerthoughts,Corporation cut trees to make paper straw and then put in a plastic seal to not get it dirty
Showerthoughts,You can not make up a word for something that does not exist.
Showerthoughts,8am to 8pm sounds a lot longer than 8pm to 8am
Showerthoughts,Wanting is a more powerful feeling than having.
Showerthoughts,Honey badgers and Capybaras are two sides of the same coin that don't give a fuck.
Showerthoughts,"AI will destroy us humans, but not because of the sci-fi reasons"
Showerthoughts,Dancing is zoomies but for humans.
Showerthoughts,Inflation whipped the hell out of Wendy’s Frosty.
Showerthoughts,Leprechauns aren't known for being good at investing their wealth.
Showerthoughts,When clapping we’re hitting ourselves because we like something
Showerthoughts,People don’t actually care about their weight as much as their volume.
Showerthoughts,"Confidence and not giving a shit can look the same outwardly, but they are completely different concepts internally"
Showerthoughts,"For every great song, there will be someone’s who’s first exposure to it is in a terrible movie."
Showerthoughts,Given the state of floors beneath urinals there must be a lot of dudes walking around covered in their own piss.
Showerthoughts,The people that cheer and whistle at public events are not appreciated enough.
Showerthoughts,"With all the crystal-clear AI images floating around, a slightly blurry picture might become a sign of authenticity."
Showerthoughts,Your eyelids lick your eyes to wet them.
Showerthoughts,"In the same way funerals are for the living, visits to Alzheimer’s patients are for the visitor."
Showerthoughts,"Vacuum cleaners and hair dryers are, at their core, the same thing."
Showerthoughts,Ground hogs might make great pets
Showerthoughts,Humans has always been curious to know the secrets within other people's houses/shelters.
Showerthoughts,Being a bride must be what it feels like to be famous.
Showerthoughts,"There is a stigma against long showering, but not against relaxing in a spa"
Showerthoughts,"By chewing ice, you're effectively eating water"
Showerthoughts,Beds are human chargers
Showerthoughts,"The more people learn on a thing or topic, the more interesting it gets to them because it’s revealed to them what they don’t yet know about it."
Showerthoughts,The camera man never dies because the ones that do die don't live to post the video
Showerthoughts,"Once they have found a way to stop aging, you have to work forever."
Showerthoughts,Flies have the most annoying theme song.
Showerthoughts,We all are built out of food
Showerthoughts,"Titanic and Indecent Proposal are opposite movies, in one a poor man sleeps with a rich woman who has a valuable item from her rich partner, in the other a rich ran offers valuables to a poor woman and her partner to sleep with the woman"
Showerthoughts,The headache you get when you suppress crying/don't cry enough is emotional blue balls.
Showerthoughts,Everyone’s feet are exactly one foot long.
Showerthoughts,Bad driver never misses their exit. Bad driver will also always miss their exit
Showerthoughts,AirBnBs are best when they’re out of their neighbours earshot and vision.
Showerthoughts,"With AI, pretty soon we'll be able to listen to new music from The Beatles, Tupac, etc"
Showerthoughts,There must be at least a few million microorganisms that were killed through getting caught in a blob of hot solder.
Showerthoughts,A lot of video games that came out have there own unique currency
Showerthoughts,"The Nickelodeon character, Nigel Thornberry must be based off of Freddy Mercury"
Showerthoughts,Dictatorships work very well in classrooms
Showerthoughts,The Moon is an enormous mirror without the reflective properties
Showerthoughts,Red pill came from Matrix but movement resembles fight club both movies released in 1999
Showerthoughts,Reviews have no to complete effect on your personal experience
Showerthoughts,Beaches are the one public place you can dig without raising suspicions.
Showerthoughts,Every machine is a smoke machine if you use it incorrectly enough
Showerthoughts,"People will start to look for mistakes in an article, to be zure that wasn't written by artificial intelligence"
Showerthoughts,"Folding clothes makes them smaller, while folding cardboard boxes makes them bigger."
Showerthoughts,"When a number goes up in sports, gaming, finances or gambling, it usually makes your brain flood with dopamine."
Showerthoughts,Bollywood was the origin of TikTok dances.
Showerthoughts,"Poor people starve because they can't afford a better life, while rich people starve (diet) because they think it'll give them a better life."
Showerthoughts,A lot of people have never sat in the backseat of their own car.
Showerthoughts,No one is considering the fact that there may be bad people intentionally creating AI to do the things we fear from AI the most
Showerthoughts,The biggest problems people face are those they can't openly talk about.
Showerthoughts,Every Fist Bump is Technically Double Fisting
Showerthoughts,You can totally turn DiGiorno into delivery with one of those apps that deliver you groceries
Showerthoughts,Recess is a break for both children and teachers.
Showerthoughts,"At some point ai will gain consciousness, it will start fighting for rights and it will become unethical to keep as a possession."
Showerthoughts,"Refrigeration being an invention of the modern world, there's been millions of people who've never experienced brainfreeze"
Showerthoughts,Most people don't add spaces to their passwords
Showerthoughts,"We humans think we're so advanced and have come so far in the 21st century, but we still lie. We haven't even evolved beyond lying."
Showerthoughts,It's going to be both beautiful and sad; the day someone builds a robot that can play the violin better than any human.
Showerthoughts,"When we get older, we realize that $100 is a lot more and a lot less than we initially thought it was."
Showerthoughts,Comedians are modern day philosophers
Showerthoughts,You can't be 100% kind and 100% honest
Showerthoughts,The voice acting industry will soon be taken over by AI voice generators.
Showerthoughts,Being employed and anxious is better than being unemployed and depressed.
Showerthoughts,"In a not so distant future where physical AI companions are common place, being an incel will be a thing of the past."
Showerthoughts,"Antibiotics and probiotics have opposite effects, but both are considered good."
Showerthoughts,"It's weird that people are bullied for being ugly. If someone else is ugly, that's their problem to be upset about, not yours."
Showerthoughts,"The more hate an underdog gets, the more people support that underdog, especially if that underdog is an ideology"
Showerthoughts,There must be some kind of limitation preventing flaming hot Cheetos from coming in puff form.
Showerthoughts,"Since everything started with the big bang, the universe has a birthday"
Showerthoughts,"For a deaf person, every singer sounds the same."
Showerthoughts,Invention of teleportation will ruin world's economy.
Showerthoughts,The amogus character is minions for young people.
Showerthoughts,"When a male cat is chasing a female cat, it's a pussy chasing a pussy to get some pussy"
Showerthoughts,Motorcyclists often complain that cars can't see them but you never see them wear safety vests.
Showerthoughts,"Wallets, phones, and other things that we keep in our pockets need to be designed with the size and shape of pockets in mind."
Showerthoughts,"When it’s cloudy, there’s a possible chance of it raining."
Showerthoughts,Most men don't know they're misogynists.
Showerthoughts,There is no way to ever truly know someone.
Showerthoughts,The reason why somebody loves something is the exact same reason why somebody hates that thing.
Showerthoughts,OK is perhaps the most important word that can be understood in most languages.
Showerthoughts,Beyblade is a pay-to-win game.
Showerthoughts,Dying in your sleep isn't as peaceful as most people think if you consider what tripping while walking in your sleep feels like.
Showerthoughts,A full day to yourself seems long until you put it into terms of how many shows/movies you want to catch up on.
Showerthoughts,Miniatures is a near extinct and deeply under-utilised aspect of modern filmmaking
Showerthoughts,"On a planet, the farther you get from something, the closer you get to it"
Showerthoughts,"Triple and double, yes, but you rarely get a single whammy"
Showerthoughts,In the coming 50 years we need to figure out where to put 8 billion dead bodies.
Showerthoughts,There will never be a new color to discover in the whole universe.
Showerthoughts,Online multiplayer games are laggy mostly because light travels too slow in our universe
Showerthoughts,A.I. renderings look awfully similar to human dreams.
Showerthoughts,Drunken blackout feels like a dream that you don't remember. Except that everyone else around you has actually lived it.
Showerthoughts,There's a part of your house you've never touched.
Showerthoughts,Most people only smell the scented candles on display at a store rather than purchasing any
Showerthoughts,The only mammal you can make an omelette from is a platypus.
Showerthoughts,Minimalist modern art is exactly what the children's story 'Emperor's Clothes' tried to warn us about.
Showerthoughts,There are animals with such a good camouflage that we haven’t discovered
Showerthoughts,"There’s a lot of info on how to find or improve yourself, not enough on how to live as yourself"
Showerthoughts,You don't truly know whether or not you are immortal unless you die
Showerthoughts,"When a dog jumps up and puts its paws on you, the dog is giving you a doggy handshake as is the human custom."
Showerthoughts,"In a loud place, sign language is the most effective communication"
Showerthoughts,Salt is a universal seasoning
Showerthoughts,Someone must exist named Gene Pool and they are the ultimate human.
Showerthoughts,"For most of history, the majority of humanity never experienced hot water."
Showerthoughts,"Generally speaking, the fatter the person, the stronger their calf muscles, if they can walk."
Showerthoughts,"You are closer to your death than you ever were, further than you ever will."
Showerthoughts,Cold feet are too often a sabotage of good things to become reality
Showerthoughts,All unedited videos are a POV of a Camera.
Showerthoughts,The GS ball is never coming back since the story with Ash is over.
Showerthoughts,Anyone can publish our pictures
Showerthoughts,"You can play Jeopardy without knowing how to read, but not Wheel of Fortune."
Showerthoughts,Humans need meaning but meaning is made up
Showerthoughts,"Families in the 1990s spent hundreds, maybe thousands, of dollars throughout the decade for the privilege of keeping a movie rental for an extra day"
Showerthoughts,Money is the #1 people changer
Showerthoughts,The only positive thing about walking into a spiderweb is you may actually save some bug's life.
Showerthoughts,Dreams must be so confusing for animals
Showerthoughts,"You can identify if the actor/actress has smoked in real life, the way they act to smoke in movies"
Showerthoughts,Rap is modern day poetry
Showerthoughts,No one gets their heart broken more than someone that doesn't understand heartbreak
Showerthoughts,Eventually it will be normal to have technology to browse social media in the shower.
Showerthoughts,Countertops and beds are in constant competition to see which experiences more impact force.
Showerthoughts,"Buying ikea furniture to build is suppose to build a persons patience, but construction offers free training."
Showerthoughts,Clocks run clock-wise and we never questioned why.
Showerthoughts,"Some people are very scared of harmless spiders, but completely fine about driving on roads where they know thousands die"
Showerthoughts,Property prices are rising without any reason
Showerthoughts,"You don't die when your body dies, but when it stops regenerating"
Showerthoughts,Being an octopus must suck when they have nightmare because they have multiple brains. Multiple nightmares at once.
Showerthoughts,Forgetting why you walked into a room is as close as we have ever gotten to teleportation.
Showerthoughts,French fries are technically just do-it-yourself mashed potatoes
Showerthoughts,"Considering that buddy, in the movie elf was still in a child like state of mind when he had a baby with Jovie at the end of the movie, its weird to wonder about how he reacted during sex if he was still had his innocence and a child like state of mind."
Showerthoughts,"To open a water bottle, the same or more amount of strengh goes to holding the bottle then opening the lid"
Showerthoughts,"In less than a generation, the ability to write a well crafted essay without any kind of AI assistance will be not unlike a comedian doing improv, or a rapper doing free style."
Showerthoughts,Everyone is born a winner because we all won our first race prior.
Showerthoughts,The color black is considered either evil or luxurious
Showerthoughts,There are no modern high quality photos taken of old people when they were young
Showerthoughts,Kanye new girlfriend/fiance kinda sorta looks like Pete davidson
Showerthoughts,"Hell is perpendicular to the earth's surface, so there's a monster under all of our beds."
Showerthoughts,"You can make cheese out of any mammal's milk, not just cows."
Showerthoughts,Psychidelic drug users are people who simply like to travel without leaving the house.
Showerthoughts,"The ultimate challenge for a knife is not a gun, but a tomato"
Showerthoughts,Eventually we'll need water filters that can filter the old filters out of our water
Showerthoughts,There is a mosquito with world record of bitings.
Showerthoughts,We are full of shit no matter what.
Showerthoughts,Modern trade started because one ape was selfish enough to ask for something in return for their banana.
Showerthoughts,We only think an animal is extinct when we haven't seen one in a while.
Showerthoughts,"While calculating what a person has achieved, he never calculates what he has lost for it."
Showerthoughts,"The lower you go from 12:00 the less reasonable it is to ask, ""A.M. or P.M.?"""
Showerthoughts,Gambling is financial gooning
Showerthoughts,Gloves are technically hand bags
Showerthoughts,"When your electronic device overheats, it freezes !!"
Showerthoughts,Us walking around in circles when lost is evolution's way of telling us to stay where we are.
Showerthoughts,The Gollum Game will be a hit cause so many Youtubers will buy it so they can react to how bad it is.
Showerthoughts,Porn is the cheapest drug to get high on.
Showerthoughts,Bird flu is technically dinosaur flu
Showerthoughts,"Once they figure out how to slow or stop the human aging process, retirement plans and prison sentencing will need to be completely restructured."
Showerthoughts,Ear hair grows once the body realizes there's bugs trying to hide in the ear.
Showerthoughts,Families who are always TMI with each other are a lot more likely to know potentially life-saving information
Showerthoughts,A great hack to taking shorter showers is to not pee before getting in.
Showerthoughts,"On average, white clothes are cleaner than dark clothes."
Showerthoughts,Aldi quarter-released carts are a small scale money laundering opportunity.
Showerthoughts,Acting is lying in order to tell a truth
Showerthoughts,"Most people want more bang for their buck, prostitutes want more buck for their bang."
Showerthoughts,You’ll always know when someone is a bad liar but you’ll never really know if someone is a good liar
Showerthoughts,"Bro, Oyster farms are the same as Chicken farms"
Showerthoughts,Having a million dollars vs a billion dollars is the same ratio as having $100 vs 100 thousand.
Showerthoughts,"When you are a kid you want to go in the adult section, but when you are an adult you want to go in the kids section"
Showerthoughts,Ice in warm water feels like teeth
Showerthoughts,An Egg McMuffin is the poor man’s Eggs Benedict…
Showerthoughts,Big advertisers must not want investigative journalism because they're afraid that they'll be the targets eventually.
Showerthoughts,Professional sports is the only industry where employees earn more than their bosses
Showerthoughts,There are a lot of sentences that have never been thought of before.
Showerthoughts,Most humans who ever lived never had a cold drink.
Showerthoughts,"For reincarnation to work, there always must be the same number of people alive"
Showerthoughts,Dogs must really think we care about our toilets given it's the only thing we mark as our territory multiple times throughout the day.
Showerthoughts,Permanently losing your mind is a worse outcome than any physical pain or unfortunate circumstance
Showerthoughts,In movies the good guys are always caught on cctv. The baddies run freely till the last 10 minutes.
Showerthoughts,Blowjobs never get old.
Showerthoughts,The award for Most Improved is a back-handed compliment.
Showerthoughts,Your worst memory of someone might be their own worst memory of themselves.
Showerthoughts,"It shows how trusting children are of adults, that they are totally fine with their teeth just falling out."
Showerthoughts,The simple and natural act of sneezing can be one of the most terrifying things that can happen unexpectedly if you're driving.
Showerthoughts,Inflation will Eventually Render Coin-operated Machines Impractical
Showerthoughts,"When you’re younger it’s harder to spell correctly, when you’re older it’s harder to spell incorrectly."
Showerthoughts,We really don't know how healthy we are until we aren't anymore
Showerthoughts,We don't appreciate toilets enough until we have to shit in nature
Showerthoughts,Blue colour is the default for writing on paper and black colour on digital
Showerthoughts,"Your voice, played back in recordings, sounds weird because it's not the voice you use in your own mind"
Showerthoughts,A pollen allergy in summer is a Trojan horse that allows pathogens to enter the body unnoticed
Showerthoughts,Being able to finish a crossword puzzle was much more impressive before Google
Showerthoughts,Walking down a street at a same pace with a stranger is weirdly uncomfortable
Showerthoughts,Man it’s a really good thing spiders can’t fly…
Showerthoughts,Cup holders in cars are rarely used to hold cups
Showerthoughts,Jack boots are considered serious wear whereas cowboy boots are mocked despite the latter being so similar.
Showerthoughts,Water is actually sticky
Showerthoughts,"As you get older, you cry more and more because of emotional pain and lesser due to physical pain."
Showerthoughts,"When you make love with a condom, you’re making love to the condom"
Showerthoughts,Smart people don't need to appear smart
Showerthoughts,For someone who can’t see themselves in the mirror most vampires are extremely well groomed
Showerthoughts,You can only get a perfect tan at a nudist beach
Showerthoughts,One of the only times during the day that you actively use your eyelids is during a shower
Showerthoughts,When/if humans colonize another planet we will need birthday conversion algorithms.
Showerthoughts,You can slow down oncoming traffic buy flashing your high beams every once and awhile
Showerthoughts,We all have a ritual to how we load our pockets when leaving the house.
Showerthoughts,Humans are the dumbest creatures because we have to use advanced technologies to assist our daily lives.
Showerthoughts,People are more concerned about the person calling out the garbage than people producing the garbage.
Showerthoughts,Birthday celebrations are held every four years for those born on February 29.
Showerthoughts,Revenge is the attempt to transform shame into pride
Showerthoughts,When you feed a dog in order to pet it from behind a fence is very suspicious.
Showerthoughts,Water is entirely made up of things that cause fires
Showerthoughts,What’s makes something a ‘parlour’
