subreddit,title
science,"Male overdose crude rates in 2020 remain larger than those of females for all drug categories except in Idaho, Utah and Arkansas where crude rates of overdose deaths by natural and semisynthetic opioids for females exceeded those of males."
science,"Researchers discovered a way to reactivate dormant cells in the retina of mice to restore vision, without the need for transplantation. This could potentially restore vision in patients suffering from degenerative retinal disease"
science,Symmetric graphene quantum dots for future qubits and realizing single-particle terahertz detectors
science,"Surviving work burnout during COVID-19: Study finds extraverts have an advantage: Although extraverted individuals are more likely to struggle with pandemic-induced social isolation, they have the social support to weather the challenges of post-pandemic work."
science,"Researchers have sequenced genomes from ancient dental calculus, providing insight into stone age bacteria. By reassembling ancient DNA fragments, they identified oral and previously unknown bacteria."
science,"According to a new study, novel observations of the gigantic bubbles of gas around the Milky Way have revealed new details about the origin of these mysterious entities."
worldnews,"/r/WorldNews Live Thread: Russian Invasion of Ukraine Day 459, Part 1 (Thread #600)"
worldnews,Belarus official: West left us no choice but to deploy nuclear arms
worldnews,"French medical bodies on Sunday called on authorities to punish researcher Didier Raoult for ""the largest 'unauthorized' clinical trial ever seen"" into the use of hydroxychloroquine to treat Covid-19"
worldnews,Ukraine plans to impose sanctions against Iran for 50 years
worldnews,Lukashenko says Putin to give nuclear weapons to anyone who joins Union State
worldnews,Zelenskyy thanks Ukrainian Air Defence Forces and State Emergency Service after most massive Russian drone attack so far
worldnews,Zelenskyy congratulated Erdoğan on winning Turkish elections
worldnews,Turkey’s Erdogan wins presidential election run-off: State media | Elections News
worldnews,"More than half of voters now want Britain to forge closer ties with the EU, poll reveals"
worldnews,"Cuban immigrants are joining the Russian army to fight in Ukraine in exchange for citizenship, a report says"
worldnews,Indigenous leaders are being murdered in Peru’s Amazon
worldnews,"US ‘ready to fight in space if we have to’, says military official | Space"
worldnews,Ukraine war: Zelenksy praises air force after Russia's largest drone attack yet
worldnews,"Germany intensifies scrutiny of far-right AfD, labeling its youth wing 'extremist'"
worldnews,Wagner's Prigozhin says Russian media ignoring him will spark backlash
worldnews,Putin congratulates Turkey's Erdogan
worldnews,Hundreds of Muslims detained after protesting the illegal demolition of over 19 mosques by the Ethiopian Government
worldnews,"Russia launches largest drone attack yet, Kyiv officials say"
worldnews,"Israeli agents conducted raid against militants in civilian area, killing a child"
worldnews,Counting under way in Turkey's historic election
worldnews,Somalia to introduce direct universal suffrage in 2024
worldnews,"Xi more of a threat to democracies than Putin,says ex-Canada PM"
worldnews,Ukraine's Foreign Minister denies that Chinese envoy called on European countries to recognise Ukrainian territories as belonging to Russian
worldnews,Zelensky asks parliament to sanction Iran for 50 years
worldnews,Logging network operating out of Cambodian prison: Inmates manufacture luxury furniture with old growth forest timber cut from the site of a new hydropower dam
worldnews,Dual citizenship in Germany set to become easier
worldnews,Lavrov calls move to supply Ukraine with Western fighter jets ‘unacceptable escalation’
worldnews,China's 1st domestically made passenger plane completes maiden commercial flight
worldnews,Ukraine's Zelenskiy introduces Iran sanctions bill
worldnews,President of Belarus hospitalised after meeting with Putin
worldnews,Chinese warships detected passing through Taiwan Strait as China continues to step up military activities around Taiwan amid deteriorating U.S.-China ties
worldnews,Putin orders stronger Russian border security
worldnews,Hong Kong blasts Amnesty over missing Uyghur man allegation
worldnews,The Navy is creating a new organization aimed at quickly fielding maritime tools to current and potential future fights in Ukraine and Taiwan.
worldnews,Thailand air force says U.S. has denied request to buy F-35 jets over issues with training and technical requirements
worldnews,Spain's conservatives in lead in regional elections with one third of votes counted
worldnews,Venice canal patch turns fluorescent green
worldnews,Starmer plans to block all new North Sea oil and gas developments
worldnews,Halifax-area neighbourhoods evacuated as fast-moving fire engulfs homes and spreads
worldnews,New Zealand parliamentarians to visit Taiwan
worldnews,Centenary of Irish Civil War coming to an end commemorated in Dublin
worldnews,Somalia says it will revert to direct vote for officials starting next year
worldnews,NATO head urges Kosovo to ease tensions with Serbia
worldnews,Ukraine war: Kyiv hit by new massive Russian drone attack - mayor
worldnews,"South Korea successfully launched a commercial-grade satellite for the first time as part of its growing space development program, as rival North Korea is pushing to place its first military spy satellite into orbit."
worldnews,The U.S. told them terrorists killed their brother. It was a lie they held for years
worldnews,Cuba says no quick fix as economic crisis drags on
worldnews,"Rejection of NATO, EU and Russian as state language: Russian Foreign Ministry lists new ‘conditions for peace’"
worldnews,"US, EU, NATO congratulate Turkey’s Erdogan, stress importance of ‘working together’"
worldnews,"Iran exchanges heavy gunfire with Taliban on Afghan border, escalating tensions over water rights"
worldnews,(Iran) Zahedan’s Weekly Protests Met with Mass Arrests
worldnews,"Former PMs Harper, Campbell back letter calling on Trudeau, Biden to act against Iranian regime"
worldnews,Modi opponents boycott opening of new Indian Parliament; PM says it breaks with colonial past
worldnews,Indian Olympic wrestlers detained as latest protest escalates
worldnews,UAE to land a probe on an asteroid between Mars and Jupiter in 2034
worldnews,Deep-sea mining hotspot teems with mystery animals
worldnews,Russian Prime Minister Gets an Awkward Reception on Trip to China
worldnews,Turkey’s President Erdogan seals election victory to enter third decade in power
worldnews,"US, Saudi Arabia call for warring sides in Sudan to extend 'imperfect' cease-fire"
worldnews,"North Korea announces plan to launch satellite in coming days, Japan issues warning for ships passing through Yellow Sea, East China Sea and east of the Philippines’ Luzon Island"
worldnews,"U.S., Saudi Arabia call for extended ceasefire in Sudan"
worldnews,Turkish election victory for Erdogan leaves nation divided
worldnews,India’s vast new parliament opened by Narendra Modi amid opposition boycott | India
worldnews,Hopes Crushed in Search for Missing Climber on Mount Everest.
worldnews,Russia's Aeroflot Airlines Resumes Flights to Cuba July 1st
worldnews,"Second Pakistani journalist missing, family alleges abduction"
worldnews,EU steps up support for Moldova with leaders due to attend summit
worldnews,"Iran Exchanges Heavy Gunfire With Taliban on Afghan Border, Escalating Tensions Over Water Rights"
worldnews,"US, Saudi Arabia call on Sudan warring sides to extend ceasefire"
worldnews,Turkey's Erdogan claims victory in presidential election
worldnews,Boris Johnson tried to persuade Donald Trump to back Ukraine on US tour
worldnews,‘Arrogant king crushing voice of public on streets’: Opposition leaders slam Delhi Police action against wrestlers
worldnews,Two men charged after police find $60m worth of cocaine in shipping container in Sydney
worldnews,At least three killed in clash over water rights on Iran-Afghan border
worldnews,"Iran, Taliban exchange heavy gunfire in conflict over water rights on Afghan border"
worldnews,"Netherlands arrests more than 1,500 climate activists during a protest against Dutch fossil fuel subsidies"
worldnews,Erdogan Seals Election Victory in Turkey to Defy Naysayers
worldnews,"A Quick Ukrainian Defeat Of Russia Lessens Chances Of 'Black Swan Event,' Argues Former Military Adviser To Ukraine"
worldnews,"Russia begins talking about peace again, seeking “recognition of territorial arrangements” and cessation of Ukrainian forces’ actions"
worldnews,Spain heads to polls amid rows over Eta and allegations of voter fraud
worldnews,"US 'won't tolerate' China's ban on Micron chips, commerce secretary says"
worldnews,Witness at the Trial of Former Kosovo President ‘Found Body of Victim of Kosovo Guerrillas’
worldnews,"Stoltenberg: Pristina must de-escalate and not take unilateral, destabilizing steps"
worldnews,"A growing number of LGBTQ+ Russians seek refuge from war, discrimination in Argentina"
worldnews,Ukrainian military starts training on Abrams tanks in Germany – Pentagon
worldnews,Twitter withdraws from EU disinformation code | Lux Times
worldnews,Zelenskyy sanctions 220 Russian and Belarusian companies
worldnews,Sudanese army chief asks UN to dismiss envoy
worldnews,Global warming set to break key 1.5C limit for first time
worldnews,"More than 1,500 climate activists arrested in the Netherlands amid protests"
worldnews,The European rapporteur for Kosovo assessed the scene in front of the Zvečan municipal building as scary
worldnews,Sunak ‘to urge supermarkets to cap price of food basics amid inflation’
worldnews,"Report: ‘massive’ Tesla leak reveals data breaches, thousands of safety complaints | Tesla"
worldnews,Protesters encircle Serbian state TV building to press government to ease its grip on media
worldnews,"Kyiv: Russian drone strike kills one in Ukraine capital, says mayor"
worldnews,Chhattisgarh official drains reservoir to find cellphone he dropped during selfie
worldnews,Iranians arrive in Saudi Arabia for Hajj amid thaw
worldnews,Serbian Church Protests Banned Event at Contested Church in Kosovo
worldnews,U.S. 'won't tolerate' China's ban on Micron chips-Raimondo
worldnews,World Bank gives Mozambique $150m for Cyclone Freddy recovery
worldnews,Turkish election victory for Erdogan leaves nation divided
worldnews,Russia accuses Japan of ‘cynical speculation’ after Tokyo’s nuclear rebuke
worldnews,UK Ambassador Urges Kosovo to Draft Statute for Association
worldnews,Denmark launches special investment fund for Ukraine with a total of US$134 million
worldnews,World leaders congratulate Turkey’s Erdogan on election win
worldnews,Somalia to introduce direct universal suffrage in 2024 | news.com.au
worldnews,"More than 1,500 arrested at Extinction Rebellion protest in The Hague"
worldnews,Ancient tombs and mummification workshops unearthed in Egypt
worldnews,Tehran accuses Zelensky of anti-Iran propaganda for call to stop Russia drone supply
worldnews,Uyghur student missing after texting that he was being interrogated by Hong Kong police – Amnesty
worldnews,Tens of thousands protest judicial reform across Israel for 21st weekend
worldnews,Turkish presidency run-off decides if Erdogan should have five more years
worldnews,China deletes 1.4 mln social media posts in crack down on self-media accounts
worldnews,Japan’s GSDF Holds Live-Fire Drill
worldnews,"Tens of thousands in Serbia protest mass shootings, government policies"
worldnews,US Select Committee on CCP recommends India to be part of NATO Plus
worldnews,"Border Clashes Subside Between Iran, Afghanistan"
worldnews,Turkey election: President Erdogan declared winner in Turkey presidential election
worldnews,Hong Kong's pro-democracy Civic Party votes to dissolve
worldnews,"Egypt unearths mummification workshops, tombs in ancient burial ground"
worldnews,Serbian border troops on high alert after ethnic clashes inside Kosovo
worldnews,"Russia thwarts drone attack on Krasnodar oil refinery, officials say"
worldnews,Aid agencies back UN’s $7bn appeal for Horn of Africa food crisis
worldnews,Official death toll in Myanmar cyclone rises to at least 54
worldnews,Super Typhoon Mawar strengthens into most powerful storm on Earth in more than 2 years
worldnews,Peru police seize cocaine marked with Nazi swastikas headed for Belgium
worldnews,Ukraine Asks Germany To Provide Taurus Long-Range Missiles
worldnews,Ukraine war: Russian Ambassador Andrei Kelin issues warning of escalation in Ukraine
worldnews,Senator Graham says Ukraine's counteroffensive will show results in coming days and weeks
worldnews,"China’s top server makers stop orders of memory modules containing Micron chips, sources say"
worldnews,Vancouver doctor dies while climbing Mount Everest
worldnews,NATO urged Kosovo to de-escalate tensions with Serbia
worldnews,Hundreds of expelled Germans set to leave Russia
worldnews,Ukraine says Russia plans to simulate accident at nuclear power plant
worldnews,Brazilian president refuses to come to Russia at Putin’s invitation
worldnews,"China, South Korea agree to strengthen talks on chip industry, Chinese commerce ministry says"
worldnews,"/r/WorldNews Live Thread: Russian Invasion of Ukraine Day 458, Part 1 (Thread #599)"
worldnews,French lawmakers set to pass law to crack down on influencers
worldnews,Pakistan avalanche kills 11 people from nomadic tribe
worldnews,Tehran Police Issue Warning As Drivers Cover Up License Plates
worldnews,31 Lebanese MPs call for end to Hezbollah’s armed status
worldnews,"Christians caught with a Bible in North Korea have faced death and had their families, including children, thrown in prison for life, a new report says"
worldnews,Erdoğan claims victory in Turkey's presidential runoff
worldnews,Japan Self-Defense Force conducts large-scale live-fire drills
worldnews,EU will go easy on Indian resale of Russian fuel
worldnews,"“Cigarettes belong in museums,” says Philip Morris International CEO in speech in London, calling on governments globally to accelerate end of cigarettes"
worldnews,"West Papua rebels threaten to shoot Phillip Mehrtens, pilot from New Zealand, if talks about independence from Indonesia denied"
worldnews,Saudi Arabia is snapping up millions of barrels of Russian diesel that Europe no longer allows and sends its own to Europe
worldnews,Deadly Russian strikes obliterate Dnipro medical facility in central Ukraine | CNN
worldnews,Taiwan reportedly receives Stinger missiles under U.S. military aid program
worldnews,"In Russia, children will be sent to patriotic camps and taught to shoot and fly UAVs"
worldnews,Royal Navy’s most advanced destroyer deploys to the Caribbean
worldnews,Serbian President Vucic To Step Down As Party President
worldnews,Indian soldiers beat 3 journalists in Manipur
worldnews,Netherlands “seriously considering” sending F-16s to Ukraine
worldnews,China Select Committee of US House recommends making India part of NATO Plus
worldnews,Japanese naval ship to fly Rising Sun flag at drill in South Korea
worldnews,Ukraine war: Russia destroys hospital in latest missile attack
worldnews,Volgograd student who burned Koran is demanded for punishment in Chechnya | СокальINFO
worldnews,Wagner Group started to withdraw from some positions in Bakhmut - UK intelligence
worldnews,"Poland passes contentious bill to examine Russian influence | The law, backed by the ruling Law and Justice party, is seen as targeting former Prime Minister Donald Tusk ahead of key elections next year. Critics say the measure is unconstitutional."
worldnews,UK intelligence says Wagner's forces withdraw from their positions around Bakhmut
worldnews,"7,000 year-old road found under the Mediterranean Sea in Croatia"
worldnews,Poland's lawmakers approve contentious law targeting opposition
worldnews,Second Quebec group suspected of hosting Chinese 'police station' received federal funding
worldnews,"Queensland ""Sovereign citizen"" deemed unfit to hold gun license."
worldnews,China warns against Japan PM's attendance at NATO summit
worldnews,Cannes Film Festival 2023: Justine Triet's 'Anatomy of a Fall' wins Palme d'Or
worldnews,"Hungary ‘unfit’ to hold EU presidency, warn MEPs"
worldnews,Serbia blasts NATO forces over inaction during Kosovo clashes
worldnews,Solar power due to overtake oil production investment for first time in 2023
worldnews,"Brussels, Tehran Swap Prisoners In Move Criticized By Iranian Exile Group"
worldnews,EU condemns supply transfer of Russian nuclear weapons to Belarus: it contradicts Budapest Memorandum
worldnews,Medvedev declares war in Ukraine would last for decades and threatens with nuclear strike again
worldnews,Chaos at UK airports as nationwide border system fails | CNN
worldnews,Saudi Arabia has ambitious plans for space
worldnews,UK Ministry of Defence condemns 'desecration' of Royal Navy wrecks
worldnews,Families call for abductees' return from N.Korea while parents live | NHK WORLD-JAPAN News
worldnews,Chaos at UK airports as Border Force systems down nationwide with arrivals forced to wait in 'mother of all queues'
worldnews,Ancient toilets unearthed in Jerusalem reveal a debilitating and sometimes fatal disease
worldnews,Chinese ships ignore Vietnam demand to leave area close to gas fields
worldnews,Wagner Group regroups in 3 areas following Bakhmut withdrawal – Ukraine's National Security and Defence Council
worldnews,Taiwan says Chinese aircraft carrier sailed through strait – DW
worldnews,"US rebukes Kosovo for escalating tensions, Serbia puts army on alert"
worldnews,Jets to Ukraine: Crucial questions over supplying F-16s to Kyiv
worldnews,Serbia president puts military on combat alert
worldnews,North Korea spent the pandemic building a huge border wall
worldnews,"Blinken to push Turkey, Hungary to ratify Sweden joining NATO"
worldnews,Google removes 'Slavery Simulator' game amid outrage in Brazil
worldnews,World Cup security guards still jailed in Qatar after dispute over unpaid wages
worldnews,"India, Russia settling some non-oil trade in rupees: Top Bank official"
worldnews,"Scholz: Our support for Ukraine is unwavering, Russia must withdraw its troops"
worldnews,Sudan army calls on former soldiers to re-enlist as fighting persists through ceasefire
worldnews,Senior US general ordered Twitter announcement of drone strike on al Qaeda leader that may have instead killed civilian
worldnews,Ukraine's military intelligence says Russia planning large-scale provocation at occupied nuclear plant
worldnews,"Peru protesters, including children, killed in 'extrajudicial executions' by security forces, Amnesty finds"
worldnews,"Russian weapons manufacturers hosted at Saudi trade event | Companies with direct links to Russian military set to attend, which is likely to heighten tensions with US"
worldnews,Serbia sends army to Kosovo border as protest escalates – DW
worldnews,Explosions reported in center of Russian city of Krasnodar
worldnews,"Japan adopts new sanctions on Russia, criticizes its deal to deploy nuclear weapons in Belarus"
worldnews,Tokyo court rejects families' request for removal of Koreans' names listed in Yasukuni Shrine
worldnews,"Possibly a new species, a 100-million-year-old fossil was discovered in the Australian outback"
worldnews,"Serbia President Puts Military on Combat Alert, Orders Army to Move Closer to Kosovo Border"
worldnews,"India to push back against 'agenda-driven' global ranking firms, Modi adviser says"
worldnews,Russia Preparing Nuclear Provocation At Zaporizhzhia NPP - Defense Intelligence Representative Yusov
worldnews,"Investment in solar power to outstrip oil for first time, says IEA"
worldnews,Soaring airline customer complaints push global legislators to act
worldnews,CNN: White House official says US has 'made it very clear' to Ukraine it does not support attacks on Russian soil
worldnews,India to push back against ‘agenda-driven’ global ranking firms: Modi advisor
worldnews,Seaweed could avert food crisis caused by extreme weather | Environment
worldnews,Putin's ambassador to Britain warns of 'escalation' in Ukraine
worldnews,"Three Russian Regions Attacked By Ukrainian Forces, Governors Say"
worldnews,"Rights Group: Uyghur Student Missing in Hong Kong, Feared Detained"
worldnews,Gun and drug trafficking ring busted in raids across Europe
worldnews,World's richest countries are fuelling what a human rights group calls 'modern slavery' | CBC News
worldnews,Finland to see biggest property price drop in 30 years
worldnews,Ukraine war: Russia destroys hospital in latest missile attack
worldnews,"Electricity prices in Finland flipped negative — a huge oversupply of clean, hydroelectric power meant suppliers were almost giving it away"
worldnews,Pakistan Army has put the lid on Imran’s revolt &amp; now wants million acres of land in Cholistan
worldnews,"Ukraine very interested in Brazil taking part in Peace Summit, implementation of Ukrainian Peace Plan – President’s Office"
worldnews,Peru police seize cocaine packets with Nazi flag and Hitler's name printed on the outside
worldnews,Iran's Hard-Liners Blast Tougher Proposed Hijab Legislation -- As Too Lenient
worldnews,Russia's attack on the night of 25–26 May: Ukraine's air defence destroyed 10 cruise missiles and 23 Shahed drones
worldnews,"Germany: Last Generation climate activists plan further protests after police raids, blocking of official website"
worldnews,Seoul barred Pride from its usual venue – now some students want to do the same on campus
worldnews,"Fulgence Kayishema: Rwandan accused of killing 2,000 in church arrested"
worldnews,"Tens of thousands of people converged on the Serbian capital on Friday for a major rally in support of President Aleksandar Vucic, who is facing an unprecedented revolt against his autocratic rule amid the crisis triggered by two mass shootings that stunned the nation"
worldnews,Germany falls into recession as consumers in Europe’s biggest economy spend less
worldnews,"Microsoft president Brad Smith on ""real concern"" about Chinese malware targeting critical infrastructure"
worldnews,"Register of missing people includes 23,000 names, 1500 bodies of soldiers returned to Ukraine"
worldnews,Wagner: US sanctions boss of mercenary group in Mali
worldnews,13 Chinese aircraft breach Taiwan's ADIZ: Defense Ministry
worldnews,"/r/WorldNews Live Thread: Russian Invasion of Ukraine Day 457, Part 1 (Thread #598)"
worldnews,Russia passports forced on Ukrainians ‘to erase identity’
worldnews,Australian Universities extend Indian student ban amid visa fraud concerns
worldnews,Russian MFA Hysterical over US Statements that Ukraine Could Strike Its Own Crimea
worldnews,Hundreds of newly discovered species ‘threatened’ in Mekong region
worldnews,Lukashenko: Russian nuclear weapons are on their way to Belarus
worldnews,NATO to upgrade Ukraine’s partner status without offering swift membership
worldnews,Head of Ukraine's Security Service on SSU involvement in Crimean bridge attack
worldnews,Scholz responds to Ukraine's hopes for NATO membership in Vilnius
worldnews,Deaths soar on Everest after record number of climbers attempt summit
worldnews,UK to keep Kremlin assets frozen until Russia pays compensation to Ukraine
worldnews,"Israeli agents conducted targeted killings in civilian area, killing a child"
worldnews,Chinese ships ignore Vietnam demand to leave area close to Russian-run gas fields
worldnews,NATO Considers Enhanced Partnership for Ukraine without Details on Its Accession – Media
worldnews,"UPDATES: Russian missile strike on Dnipro clinic kills 2, injures 23"
worldnews,Belgium Stops ‘Unlawful’ Sharing of Accidental Americans’ Data
worldnews,Condemning Unilateral Actions by the Government of Kosovo - United States Department of State
worldnews,At Least Two Dead After 'Extremely Heavy' Wave Of Russian Strikes On Ukraine
worldnews,"Ukraine war could last for decades, says Putin aide Dmitry Medvedev"
worldnews,Tajikistan summons Russia's envoy after Russian police beat and interrogated more than 100 Tajik students studying at a Russian university
worldnews,Supporters of jailed Iranian journalists call for trials to be held in public | Niloofar Hamedi and Elaheh Mohammadi reported on death of Mahsa Amini and face charges of conspiring with foreign powers
worldnews,Austin announced Ramstein’s agreement on training of Ukrainian pilots on F-16s
worldnews,Russia's Lavrov Tells China Envoy 'Serious Obstacles' to Ukraine Peace
worldnews,Dutch prosecutors seize land owned by Vladimir Putin’s former son-in-law
worldnews,Naval drones damage Russia's intelligence ship
worldnews,UK Parliament recognised Holodomor as genocide of Ukrainian people
worldnews,Mali: Germany Extends Mali Military Mission for Last Time
worldnews,EU Declares No Longer Dependent on Russian Energy
worldnews,"Media: NATO unlikely to offer Ukraine swift membership, considers 'upgraded relationship' instead"
worldnews,Russian media report loud explosions in central Krasnodar
worldnews,Russia stole about 4 million tons of grain from Ukraine – Ukrainian Grain Association
worldnews,Belgium swaps convicted terrorist to free aid worker jailed in Iran
worldnews,Rights groups slam severe Taliban restrictions on Afghan women as 'crime against humanity'
worldnews,WSJ: South Korea transfers artillery shells to Ukraine via 'confidential agreement'
worldnews,Russia Dissolves Oldest Opposition Party
worldnews,Turkey central bank's net forex reserves negative for first time since 2002
worldnews,Canada announces new aid for Ukraine: weapons and training
worldnews,Explosions rocks district near Azovstal steel plant in occupied Mariupol
