subreddit,title
AskReddit,Why do YOU drink?
AskReddit,"Ladies of reddit, do you enjoy watching guys masturbate? What do you and don't you like about it?"
AskReddit,What are the PROS of having kids?
AskReddit,"What was that moment when you see someone do something stupid and just think to yourself,"" well, they're fucked.""?"
AskReddit,"Women of reddit, what are secrets that men don't know about women ?"
AskReddit,What’s a conspiracy theory you genuinely believe in?
AskReddit,What has a psychic or medium told you that convinced you they were legitimate?
AskReddit,Whats a man to a king? What’s a king to a god? What’s a god to a non-believer?
AskReddit,"[Serious] Reddit, what’s your message to people struggling with mental health?"
AskReddit,What is you guys’ opinion on green beans?
AskReddit,"Women of Reddit, how does it feel when your partner sucks/play with your boobs?"
AskReddit,"Girls, do you swallow, do you gargle, do you spit, are you moving away when he comes?"
AskReddit,What is the horniest thing y'all have done and why?
AskReddit,"Older men of Reddit, what younger men do nowadays that you can’t wrap your head around?"
AskReddit,What platform is everyone going to use when reddit disables 3rd party apps?
AskReddit,What animals do you need to boop when you see them?
AskReddit,"If you could call a fictional lawyer, who would it be?"
AskReddit,What song sounds completely unlike the genre it technically represents?
AskReddit,What is the best food after sex?
AskReddit,what are some home made diy sex toys that you made ?
AskReddit,"(Serious) Guys who have a lot of sex with women, how do you do it?"
AskReddit,"Asking Men, what kind of support do you wish you had during hard times?"
AskReddit,What do you think about Scorpios?
AskReddit,What is thr best way to release nausea during a pregnancy?
AskReddit,"Women of Reddit, what’s the story behind how a guy missed his shot with you?"
AskReddit,Which cartoon character do you despise most?
AskReddit,Whats YOUR red flag?
AskReddit,"Out of curiosity, what is it like being a man?"
AskReddit,"Jewish Redditors, how do you feel about being called a ""Jew?"""
AskReddit,What are some movies where you gasp when you heard someone hasn’t watched it?
AskReddit,what do you think happened to jonbenet ramsey ?
AskReddit,"What was today's ""WTF"" moment for you?"
AskReddit,(from a bi guy) how does it feel to only ever like one gender? whats the mind process?
AskReddit,"people who cheated on their partner, what happened?"
AskReddit,"You are on death row. What is your last meal, chosen specifically to be the biggest burden?"
AskReddit,What is the messiest food to eat?
AskReddit,Who is the most evil person alive?
AskReddit,You're guaranteed to make millions a year on OnlyFans but because you now have massive and beautiful titties on top of your head. Will you take that deal? Why or why not?
AskReddit,What do you do to really pleasure your girl during sex?
AskReddit,What acts of debauchery do you intend to engage in this weekend?
AskReddit,What was that “Aha” moment you’ve had during sex?
AskReddit,"serious question: people who watch golf, why?"
AskReddit,"Italians of Reddit, What is your opinion on Pineapple Pizza?"
AskReddit,"What are some underrated/wholesome/awesome memories, you have with your SO?"
AskReddit,Men of reddit..According to you what is the biggest turn-off in a woman for men?
AskReddit,What are things that the United States is best at?
AskReddit,What's the definition of Simp?
AskReddit,What disgusts you more on social media these days?
AskReddit,"If you could live anywhere in the world with all expenses paid for a year, where would you choose?"
AskReddit,What are you mostly angry about in the world?
AskReddit,"Guys with multiple girlfriends/open relationships/girlfriend+side chick, how's it going, how did you do it and how did you convince your partner?"
AskReddit,What is the best way to make the most money possible with a gofundme?
AskReddit,how do you live with yourself knowing you took a life?
AskReddit,Why didn't Bud Light Use someone like John Cena instead?
AskReddit,How does one stop friend requests that are just only fans adverts?
AskReddit,"What would be a better gift for a 33-year-old male: an iPad Pro, Xbox/PlayStation, Mac Mini M2 Pro, or a Trek Domane AL4 bike?"
AskReddit,[Serious] Redditors: Who has more integrity? Politicians or Porn stars?
AskReddit,"What is a good song on a ""bad album""?"
AskReddit,Why are you high?
AskReddit,What color is your Bugatti?
AskReddit,What does being high feel like and where do you buy vapes for cheap?
AskReddit,What do you miss about the pre-iPhone world?
AskReddit,What color are subjects in school?
AskReddit,What are methods to use in order to easily attract a guy?
AskReddit,"People that don't drink, what are y'all doing in the weekends?"
AskReddit,"In honor of pride month, LGBTQs of Reddit, what is a time your gayar reading has gone horribly wrong?"
AskReddit,What job won’t be around anymore in 10 years?
AskReddit,"If music were a drug, what is a part of a song that would get you high?"
AskReddit,How often do you think about your weight?
AskReddit,"People in relationships or marriages who go to strip clubs, why? What’s the appeal?"
AskReddit,What is your article of clothing that makes you feel ‘at home’ when you wear it?
AskReddit,What's the Most traumatic thing you have ever experienced or seen in your life?
AskReddit,To what extent do Trump groupies think that they’re on a special real life version of The Apprentice?
AskReddit,"As a runner, what is the one advice you'd give to someone starting to run(5K/10K/ Half marathons)?"
AskReddit,What was your horniest sexting session on reddit like?
AskReddit,What do college kids do on the weekends if they don’t drink or smoke? How does someone like that even make friends?
AskReddit,How to get revenge on an ex?
AskReddit,"What's your response to ""fucking pussy""?"
AskReddit,What are you most tired of with people who are anti-gay?
AskReddit,People with sleep paralysis. What was the scariest episode you’ve had?
AskReddit,What’s your scary stories from living in or visiting the Appalachian mountains?
AskReddit,Whats better than blow job?
AskReddit,What a the humility ritual in Hollywood?
AskReddit,"This could be a sign, what do you think?"
AskReddit,"Redditors of Reddit, what is the most chungusly wholesome thing you did that made your doggo say “everyone liked that?”"
AskReddit,(Serious) What is the most fucked up thing you learned happened to someone?
AskReddit,"Fellow weebs of reddit, what is your favorite anime and/or genre?"
AskReddit,"New Reddit posts not showing on wall, and some were deleted- why?"
AskReddit,what is the greatest fight scene in movie history?
AskReddit,How do you bring yourself to end a relationship with a married man?
AskReddit,What was something unexpectedly positive which had happened to you recently?
AskReddit,What are some GREEN flags to look for when finding a job?
AskReddit,What is the stupidest thing that you have done and not regretted?
AskReddit,How low will you be willing to degrade yourself for a million dollars?
AskReddit,Why are you still single?
AskReddit,Which tourist attractions can give people a sense of nature and tranquility?
AskReddit,Whats the fastest way to knock someone the fuck out?
AskReddit,Guys does it turn you on when your female friend tells you about her sex life?
AskReddit,"if you could press a button and make any celebrity stub their toe, who would you pick?"
AskReddit,Whats the creepiest experience you've had at your friends house?
AskReddit,What are your opinions on Peodophile Hunting Groups?
AskReddit,What you ain't got time for?
AskReddit,"People who date significantly older partners, story?"
AskReddit,What is the strangest thing you have ever eaten?
AskReddit,How did you get into your first fistfight?
AskReddit,What are some playful ways to mess with people without causing harm?
AskReddit,"What's the most heartwarming act of kindness you've ever witnessed or been a part of, and how did it restore your faith in humanity?"
AskReddit,What’s your darkest thought?
AskReddit,What’s the most annoying sound in the world?
AskReddit,What kind of get togethers do you see people being excluded for due to their gender?
AskReddit,What are some things that are illegal that you wish were legal?
AskReddit,What is that first song that really got you into music?
AskReddit,What made that unforgettable stranger unforgettable?
AskReddit,What do you do if you lose interest in hobbies when people acknowledge you doing them?
AskReddit,USPS delivered but not received. It worth few thousands. How to find it back?
AskReddit,"If you could turn yourself into an animal for a day, which one would you choose and why?"
AskReddit,What would be a great video game to voice troll in?
AskReddit,"When you have it all, what is the one thing that you’re still chasing after?"
AskReddit,How did you disappoint your parents the most?
AskReddit,"What have you done to get back at a cheating spouse? Did you cheat as a result? If so, how did that turn out?"
AskReddit,"Okay people of Reddit, what's your pet peeve?"
AskReddit,What film or show have you never seen even once?
AskReddit,What celebrities do you think use reddit?
AskReddit,What is the best human trait?
AskReddit,"When visiting another state, what thing surprised you the most about it?"
AskReddit,What's your state known for?
AskReddit,What news stories do you scroll past or ignore because it just pisses you off?
AskReddit,"What job or career isn’t unionized, but should be?"
AskReddit,[NSFW] If a 15 yr old (M) SA a 21yr old (F) will the Female be considered the one who SAed?
AskReddit,What do you think about Nintendo (Switch or Lite)?
AskReddit,"If you could say anything you wanted the day you were born, what’s the first thing you would say?"
AskReddit,What Super Power would you pick and how would you use it?
AskReddit,What would you tell the world about your life that isn't as it seems if you could?
AskReddit,Why would one argue that balloons are the single greatest invention of mankind?
AskReddit,"When you have the choice between eating your food inside or out in the sun, what makes people choose outside when it's more comfortable to eat indoors?"
AskReddit,What thing in your home has the most duck tape?
AskReddit,Spouses with average (or below average) looking partners: what keeps you from pursuing someone more attractive?
AskReddit,How does antibiotics get ear wax out?
AskReddit,What do you need to get off your dick?
AskReddit,What body part turns you on the most and why?
AskReddit,Would you rather be an ugly woman or man? And would you rather be an attractive woman or man? Why?
AskReddit,"Who is the coolest, most unforgetable person you've met on a vacation?"
AskReddit,Who is your favorite Roman emperor?
AskReddit,what are some rare cases where an artist's best song is the most popular?
AskReddit,How did you cope when you had to leave a senile parent living by themselves?
AskReddit,"People who payed a bribe to law enforcement in a foreign country to make a problem go away (innocent or not) , what happened?"
AskReddit,How do you recover from being rejected when they still want to be friends and you still want them in your life?
AskReddit,What would you send your past self from something you have today?
AskReddit,What if Bella starts crying right next to you right now?
AskReddit,"Medical professionals, what is the strangest diagnosis you’ve had to give?"
AskReddit,[NSFW] There's a lot of songs about a girl's first time. What songs are about a boy's first time?
AskReddit,"What's your response to ""cocksucking motherfucker""?"
AskReddit,Which countries would the average person considered a king in terms of how cheap it is?
AskReddit,If each state was represented by one movie what would it be?
AskReddit,"What local company did you a solid, now you will never go elsewhere?"
AskReddit,What's the dumbest thing you've said while sleepy?
AskReddit,What’s the best way to have fun as a single mom?
AskReddit,Do you think all the prices at Bob's Burgers are reasonable? why or why not?
AskReddit,How do you intend to leave your imprint on time in your life?
AskReddit,What band were you surprised to see is still around?
AskReddit,"women of Reddit, how have you forced a male to wear your used panty?"
AskReddit,What songs lyrics would you like to be updated to today's current events?
AskReddit,"What's the best ""fancy/glamorous"" city to visit in the US (like LA, NYC, Chicago, Miami, Vegas, etc)?"
AskReddit,"Juneteenth Question: What do you think about a white grade school kid wearing a Juneteenth shirt on June 19? Where is the issue, if any?"
AskReddit,"What's the most egregious example you've seen of a word being mispronounced in a movie, TV show or video game?"
AskReddit,how do you hide a body?
AskReddit,"If humans had a third arm, where would it be located and how would it change the way we live?"
AskReddit,What’s the best “sike” moment you’ve ever seen?
AskReddit,"apocalypse is here; its your last trip, where you going?"
AskReddit,"What do you call that thing youtubers do where they're taking about a video, usually the title of their video, that you didn't know was gonna have them in it, but then they're talking about that video for 20 minutes, explaining (interrupting) your experience, you to you like you're an idiot..?"
AskReddit,"Yo, who still be droppin that top shelf content kid? and why?"
AskReddit,What was your strangest dream?
AskReddit,"What insane life event happened to you, which is incredibly unbelievable?"
AskReddit,"If you can build a new car free or car light city in the us, Where would you build it?"
AskReddit,What’s the most awful stuff you’ve seen in school?
AskReddit,What's your story of needing to piss so badly whilst in a crowd with no toilet is anywhere near?
AskReddit,"If you had to watch 5 youtubers for exactly 1 year, who would they be?"
AskReddit,what's the weirdest way you've seen someone cope/deal with something?
AskReddit,What’s something in your life that proves you’re not an NPC?
AskReddit,What are some good portable AC units that can actually cool down an entire small bedroom?
AskReddit,What can’t you live without for a day?
AskReddit,who is your favorite celeb couple?
AskReddit,What habit seems harmless but have the potential to turn into a very bad thing?
AskReddit,How To Cut Ties With A Childhood Friend Without Making It Weird?
AskReddit,How to change a straight man?
AskReddit,What’s your favorite meat to eat?
AskReddit,What’s the most shameful thing you’ve done?
AskReddit,What things would you buy with an extra 100 dollars worth of groceries?
AskReddit,What’s your funniest wedding story?
AskReddit,Who is the coolest fictional character?
AskReddit,"women of Reddit, do you like an aggressive bad boy man or a man who is not very aggressive but rather a calm and peaceful guy, which one will you choose and why?"
AskReddit,What is your favorite comfort food?
AskReddit,"Who is a fictional character you'll always root for, no matter what?"
AskReddit,What is a food or restaurant item you wish was brought back?
AskReddit,What is the best dish considered healthy?
AskReddit,"Moms , how do you know if your kid is masturbating?"
AskReddit,(go nuts under the anonymity reddit offers) Whats the most selfish thing you've ever done as a human being?
AskReddit,How did the things you did in school affect you in the future?
AskReddit,What was your gravest mistake?
AskReddit,What's a secret you've never told anyone that you're willing to share anonymously?
AskReddit,"Girls, what is the most random place you’ve got your period?"
AskReddit,How does medication have the correct dosage in each pill or x ml of liquid? How does the manufacturing process ensure that the active ingredient is the correct amount when it is manufactured in bulk?
AskReddit,You are at your average local supermarket - what grouping of regular items are the most suspicious at checkout?
AskReddit,Whats the most elaborate trap you created to get back at or trap someone to prove a point?
AskReddit,"Those that are in fwb relationships, how often do u see and text eachother?"
AskReddit,Would you continue to work at a job where you don't get along with co workers? Why?
AskReddit,What do you feel is more difficult to open than those little bags of peanuts they give you on airplanes and why?
AskReddit,What is the best compliment you ever received for sexual abilities?
AskReddit,What do you think they do in hell all day?
AskReddit,What do you think they in heaven all day?
AskReddit,What would you do if you offended your teachers with your essay?
AskReddit,What do you regret buying?
AskReddit,What are your thoughts on the Canadian accent?
AskReddit,How do you make it easier to afford rent?
AskReddit,What is something you've done that you recommend everyone do before they die?
AskReddit,What is your weirdest experience while drunk?
AskReddit,Restaurant/bar staff of Reddit. How do Drag Queens tip?
AskReddit,Why do you drive a Smart Car in 2023?
AskReddit,[serious] what would you tell someone that is trying to date a girl or boy that likes multiple people the same way they like them?
AskReddit,"First responders, what is the most embarrassing call you ever responded to?"
AskReddit,"What is up with the weird accounts called ""signal tap (insert numbers here)"" following people?"
AskReddit,"If every Pokémon was a starter except for legendaries and mythicals, which pokemon you picking?"
AskReddit,"80's stock brokers that made big money during the decade, what was it like?"
AskReddit,"What's something that really bugs you, but others might find as a minor inconvenience?"
AskReddit,What is one thing that helps when feeling homesick?
AskReddit,What song comes on in your car that makes you feel like you can take all the ass?
AskReddit,What is something that was ok in the 1980s that is not ok anymore?
AskReddit,What are your favorite snacks?
AskReddit,"Fight fans, what's some techniques you're surprised more MMA fighters aren't doing, why?"
AskReddit,What are people trying to achieve when they brag about how much zaza they can smoke?
AskReddit,What computer/console game have you played for years and still love?
AskReddit,"Tall girls who have dated a shorter guy, what was the height difference and why did you date them?"
AskReddit,what are your thoughts on the movie sharks of the corn?
AskReddit,"Paimei vs Terry Silver, who wins?"
AskReddit,"If you had the skills to make a cover of any song, which would it be?"
AskReddit,"Forensic Scientists of Redit, what's something someone thinking of entering the field should know?"
AskReddit,How can one identify an unknown substance?
AskReddit,What belief do you have in destiny?
AskReddit,"Car Enthusiasts, What was the coolest car you've seen in person?"
AskReddit,what's the most interesting or bizarre coincidence you've ever experienced?
AskReddit,Women of reddit what do you want to hear when getting picked up?
AskReddit,What's going to be your Trick this Halloween when the kids say Trick or Treat?
AskReddit,What would happen if someone took mdma/xtc and went to sleep before it kicks in?
AskReddit,What’s something you can say at a dog show but not out in public?
AskReddit,"People who have been cheated on, what’s your story?"
AskReddit,How does athletes such as basketball players break in new sneakers?
AskReddit,What is it like living life as a mistress?
AskReddit,What would it feel like to be eaten by a shark?
AskReddit,What's something strange your parents did when you were a kid that makes sense now as an adult?
AskReddit,"Who is the most talented musical artist or band (Not who makes your favorite music, solely from a talent standpoint)?"
AskReddit,How often do you wear your seatbelt?
AskReddit,"People who don't watch television at all, why not?"
AskReddit,What caused you to cut your parents out of your life?
AskReddit,What is the best bit of advice you have ever had?
AskReddit,"If you had a $100 Amazon gift card that you had to spend in 10 minutes, what would you buy?"
AskReddit,"When you go into a nursing home, do you lose your disability payments or just use Medicaid/Medicare?"
AskReddit,Where is the best place in town to get Hamberders?
AskReddit,What’s an advantage of being a tall person?
AskReddit,What's a plot-hole on par with Titanic's door was was big enough for both of them?
AskReddit,"Is it possible to find out what company a tractor trailer belongs to using only the license plate? If so, how?"
AskReddit,"People at weedings where people didn’t hold their peace, why and how?"
AskReddit,"What are some songs with great, suspenseful, unforgettable intros?"
AskReddit,What is the most annoying thing your kid has done for attention?
AskReddit,What class do you wish you paid closer attention to in high school?
AskReddit,"People of reddit who has met a celebrity and treated them like another normal person rather than freaking out, what was their reaction?"
AskReddit,What's in your perfect burger?
AskReddit,What’s your favorite color?
AskReddit,What can you say in bed and at the air port ?
AskReddit,What's the craziest disappearance or missing person case you've heard about?
AskReddit,"What passage of the Bible is considered ""indecent"" and could be banned if it was shared as a children's book?"
AskReddit,Which moment of your life made you feel like you were crazy/ off reality?
AskReddit,What’s the most 90’s song ever made?
AskReddit,"Mommas: What are the symptoms of a lack of boundaries for you? And, what gets in the way of setting them?"
AskReddit,Which is your favorite place to visit in Canada?
AskReddit,"Publishers of Reddit, what are some of the weirdest manuscripts that you’ve ever seen submitted?"
AskReddit,What do you think about posts of dead people on Reddit?
AskReddit,what are fun things to do during summer with friends??
AskReddit,"People of Reddit, how do you avoid freaking out when speaking in front of a big audience?"
AskReddit,"What would happen if the entire medical industry (doctors, nurses, hospitals, pathology labs, everything) just disappeared overnight?"
AskReddit,"If you could leave a fat turd on one celebrity/politician’s desk, who’s would it be?"
AskReddit,What’s your biggest self disappointment?
AskReddit,When updating contacts from iPhone can emojis be added to the contact?
AskReddit,"If you've never touched black hair, what do you think it feels like?"
AskReddit,Who was that one person that changed your life?
AskReddit,What's your ideal environment to hang around with friends and family?
AskReddit,What happened to the pork loin on Tazikis menu?
AskReddit,What's the hottest thing you've ever seen?
AskReddit,What’s the age you have most of your memories from?
AskReddit,What is a good thank you for babysitting gift?
AskReddit,In what way have you personally cut Russia out of your life since the invasion of Ukraine?
AskReddit,What to do to help yourself manage a depressive episode?
AskReddit,What was one time you thought you were about to die? [SERIOUS]
AskReddit,Who is jarhead and why?
AskReddit,What do you think is the TSLA stock movement on Monday June 5 given that treasury bills auction is happening bull or bearish?
AskReddit,What to do when you feel so out of place with people?
AskReddit,What if the World Economy collapsed?
AskReddit,"What is your languages equivalent of "" you could do better than him""?"
AskReddit,What is your favorite trope in fiction?
AskReddit,What is the strangest thing that you’ve consulted a lawyer (or barrister) for?
AskReddit,What’s the most underrated pieces of architecture you’ve heard of or seen?
AskReddit,What is the biggest turn on and turn off for you in the opposite gender?
AskReddit,What “incident” has happened in your school?
AskReddit,What would say to someone who makes you aa dinner that you can’t stomach to eat?
AskReddit,What’s the worst wrong-person message you’ve ever sent?
AskReddit,What mythological god would you vote for?
AskReddit,"Whats a nation wide very big company ,that you thought was local and small?"
AskReddit,"What was your favorite after school comfort show that you would watch, back in the day?"
AskReddit,What's the weirdest food combination you've tried?
AskReddit,We’re playing 20 Questions. What is your favorite question to ask?
AskReddit,What is the worst nightmare you have ever had?
AskReddit,How far back do you have to scroll to find your most recent negative karma comment and what was it about?
AskReddit,What's a juicy secret about a company you can reveal now that you're no longer part of their workforce?
AskReddit,What is the weirdest topping you’ve seen on a pizza?
AskReddit,What song makes the best alarm clock?
AskReddit,What’s the dumbest thing you’ve ever said while high?
AskReddit,What's the best coping mechanism after hitting a wild animal accidentally with your car?
AskReddit,What’s the craziest thing that happened at a birthday party?
AskReddit,"If you could only listen to one song for the rest of your life, what would it be?"
AskReddit,What is the most evil number?
AskReddit,What harmful things are currently being taught to children?
AskReddit,What would you do if you were alone in your house?
AskReddit,What would you do if you got stabbed?
AskReddit,What is the best way to fund a charity bike ride across Europe?
AskReddit,What hustle did you do in middle school?
AskReddit,What software do Kitboga and ScammerPayback use for the visual effects of their surroundings in their videos? Also do they use Mac or windows to call scammers?
AskReddit,What was the cockiest move in history?
AskReddit,How/When did you know you wanted children?
AskReddit,Which two sub Reddits have the exact same ideology but will not stand each other if they were to meet in real life?
AskReddit,What is your most embarrassing moment that happened during sex?
